Tool Name,Summary,Pricing,Link,Category
Headlime,"Revolutionize content creation with AI-driven, multilingual copywriting tool.",Paid,https://www.futurepedia.iohttps://www.futurepedia.io/tool/headlime,Copywriting Assistant
Writier,AI-powered tool streamlining content creation with real-time suggestions.,Freemium,https://www.futurepedia.iohttps://www.futurepedia.io/tool/writier,Copywriting Assistant
Copylime,"AI-driven content creation for blogs, sales, emails, and books.",Free Trial,https://www.futurepedia.iohttps://www.futurepedia.io/tool/copylime,Copywriting Assistant
Jot,"AI-driven ad copy generator for marketers, streamlining content creation.",Free Trial,https://www.futurepedia.iohttps://www.futurepedia.io/tool/jot,Copywriting Assistant
LeadScripts,"LeadScripts is an AI copywriting software that empowers users to generate high-converting copy for their marketing materials such as funnels, sales pages, emails, and ads",Paid,https://www.futurepedia.iohttps://www.futurepedia.io/tool/leadscripts,Copywriting Assistant
AI Assist by airfocus,Assistant for writing product documents.,Paid,https://www.futurepedia.iohttps://www.futurepedia.io/tool/ai-assist-by-airfocus,Copywriting Assistant
Mindwrite Ai,"AI-powered platform enhancing content creation, coding, and productivity.",Paid,https://www.futurepedia.iohttps://www.futurepedia.io/tool/mindwrite-ai,Copywriting Assistant
Phrasee,Harness the Power of AI to Elevate Your Marketing Game,Contact for Pricing,https://www.futurepedia.iohttps://www.futurepedia.io/tool/phrasee,Copywriting Assistant
AiListz,"Revolutionize content creation with AI-driven text, images, and code.",Contact for Pricing,https://www.futurepedia.iohttps://www.futurepedia.io/tool/ailistz,Copywriting Assistant
ProsePilot,"AI-driven tool enhancing writing quality, SEO, and collaboration.",Freemium,https://www.futurepedia.iohttps://www.futurepedia.io/tool/prosepilot,Copywriting Assistant
SmartBird,SmartBird: Your AI Assistant for Effortless Communication,Free Trial,https://www.futurepedia.iohttps://www.futurepedia.io/tool/smartbird,Copywriting Assistant
AI Power,"Generate high-quality content, images, and forms for WordPress.",Freemium,https://www.futurepedia.iohttps://www.futurepedia.io/tool/ai-power,Copywriting Assistant
DecEptioner,Transforming AI-Generated Text with Precision,Paid,https://www.futurepedia.iohttps://www.futurepedia.io/tool/deceptioner,Copywriting Assistant
WriteNow AI,Efficient Content Generation for Individuals and Small Businesses,Free Trial,https://www.futurepedia.iohttps://www.futurepedia.io/tool/writenow-ai,Copywriting Assistant
Aksu,"Automates SEO-friendly, long-form content creation with WordPress integration.",Paid,https://www.futurepedia.iohttps://www.futurepedia.io/tool/aksu,Copywriting Assistant
SinCode AI,"Revolutionize content creation with AI-driven, SEO-optimized writing assistance.",Free Trial,https://www.futurepedia.iohttps://www.futurepedia.io/tool/sincode-ai-,Copywriting Assistant
Copysense AI,"Optimizes, enhances, and checks content for SEO and readability.",Freemium,https://www.futurepedia.iohttps://www.futurepedia.io/tool/copysense-ai,Copywriting Assistant
QR Code AI,"Elevate engagement with artistic, insightful QR codes.",Free Trial,https://www.futurepedia.iohttps://www.futurepedia.io/tool/qr-code-ai,Design Generators
Adobe Firefly,"Transform text into vibrant images and designs, boosting creativity effortlessly.",Paid,https://www.futurepedia.iohttps://www.futurepedia.io/tool/adobe-firefly,Design Generators
Jasper Art,"Transform text into stunning, royalty-free images instantly.",Paid,https://www.futurepedia.iohttps://www.futurepedia.io/tool/jasper-art,Design Generators
Midjourney,Unlock digital artistry: AI transforms text into stunning visuals.,Free Trial,https://www.futurepedia.iohttps://www.futurepedia.io/tool/midjourney,Design Generators
Book AI Writer,Revolutionizes storytelling with AI writing and automatic cover design.,Paid,https://www.futurepedia.iohttps://www.futurepedia.io/tool/book-ai-writer,Design Generators
REimagine Home,Generative AI to redesign any room in seconds,Free,https://www.futurepedia.iohttps://www.futurepedia.io/tool/reimagine-home,Design Generators
Playground AI,Unleash creativity with AI-driven image creation and intuitive editing.,Freemium,https://www.futurepedia.iohttps://www.futurepedia.io/tool/playground-ai,Design Generators
NightCafe Studio,"Unleash AI-driven art creation, no skills required, endless styles.",Freemium,https://www.futurepedia.iohttps://www.futurepedia.io/tool/nightcafe-studio,Design Generators
MidJourney Prompt Helper,Unleash AI artistry with intuitive prompt crafting and optimization.,Free,https://www.futurepedia.iohttps://www.futurepedia.io/tool/midjourney-prompt-helper,Design Generators
Stable Diffusion,Generate stunning images from text with this AI tool.,Freemium,https://www.futurepedia.iohttps://www.futurepedia.io/tool/stable-diffusion,Design Generators
Autodraw,AI-enhanced sketching tool transforms doodles into polished art.,Free,https://www.futurepedia.iohttps://www.futurepedia.io/tool/autodraw,Design Generators
Fy! Studio,"Unlock AI-driven visual creation: simple, versatile, and highly customizable.",Free,https://www.futurepedia.iohttps://www.futurepedia.io/tool/fy-studio,Design Generators
Pollinations,"Unleash creativity with AI: generate, collaborate, evolve—open source platform.",Free,https://www.futurepedia.iohttps://www.futurepedia.io/tool/pollinations,Design Generators
Scribble Diffusion,Turn doodles into digital masterpieces with AI-powered Scribble Diffusion.,Free,https://www.futurepedia.iohttps://www.futurepedia.io/tool/scribble-diffusion,Design Generators
Stockimg AI,AI-driven tool for effortless design and content creation.,Free Trial,https://www.futurepedia.iohttps://www.futurepedia.io/tool/stockimg-ai,Design Generators
ThumbnailAi,Maximize clicks with AI-driven thumbnail effectiveness ratings.,Free,https://www.futurepedia.iohttps://www.futurepedia.io/tool/thumbnailai,Design Generators
PlayArti,"Unleash AI-powered creativity for stunning, professional digital art.",Free,https://www.futurepedia.iohttps://www.futurepedia.io/tool/playarti,Design Generators
Canva Text to Image,Transform text into stunning visuals effortlessly with AI-powered creativity.,Freemium,https://www.futurepedia.iohttps://www.futurepedia.io/tool/canva-text-to-image,Design Generators
Flair AI,Revolutionize product photography with intuitive AI-powered digital staging.,Free Trial,https://www.futurepedia.iohttps://www.futurepedia.io/tool/flair-ai,Design Generators
Gen-2 by Runway,"An AI tool that creates videos from text, images, or clips, blending creativity with technology.",Free Trial,https://www.futurepedia.iohttps://www.futurepedia.io/tool/gen-2-by-runway,Design Generators
StudioGPT by Latent Labs,Unleash creativity with intuitive AI-driven art generation.,Paid,https://www.futurepedia.iohttps://www.futurepedia.io/tool/studiogpt-by-latent-labs,Design Generators
Microsoft Designer,Unleash creativity with AI-driven design simplicity and Microsoft integration.,Contact for Pricing,https://www.futurepedia.iohttps://www.futurepedia.io/tool/microsoft-designer,Design Generators
Erase.bg,Instant AI-driven background removal and image editing for any project.,Freemium,https://www.futurepedia.iohttps://www.futurepedia.io/tool/erasebg,Design Generators
Lumiere 3D,Generate immersive 3D videos for e-commerce and marketing effortlessly.,Paid,https://www.futurepedia.iohttps://www.futurepedia.io/tool/lumiere-3d,Design Generators
Venngage,"Create personalized, visually stunning designs effortlessly online.",Free,https://www.futurepedia.iohttps://www.futurepedia.io/tool/venngage,Design Generators
Vectorizer.ai,Transform raster images to high-quality vectors effortlessly with AI precision.,Paid,https://www.futurepedia.iohttps://www.futurepedia.io/tool/vectorizer-ai,Design Generators
Galileo,Revolutionize UI design with AI-driven rapid prototyping and collaboration.,Contact for Pricing,https://www.futurepedia.iohttps://www.futurepedia.io/tool/galileo,Design Generators
Paintit,Revolutionize your space with AI-driven interior design visualization.,Free,https://www.futurepedia.iohttps://www.futurepedia.io/tool/paintitai,Design Generators
Final Touch,"Effortlessly transform product photos into captivating, professional scenes.",Free,https://www.futurepedia.iohttps://www.futurepedia.io/tool/final-touch,Design Generators
Uizard,"Harness AI to craft, collaborate, and iterate UI designs effortlessly.",Freemium,https://www.futurepedia.iohttps://www.futurepedia.io/tool/uizard,Design Generators
Top VS Best,"Empower image creation with AI, offering speed, quality, and ease.",Free,https://www.futurepedia.iohttps://www.futurepedia.io/tool/top-vs-best,Design Generators
Wallpapers.fyi,"Revolutionize your screen with hourly AI-generated, high-quality wallpapers.",Free,https://www.futurepedia.iohttps://www.futurepedia.io/tool/wallpapersfyi,Design Generators
Thinkdiffusion,"Thinkdiffusion is an accessible and user-friendly tool that provides access to powerful AI image generation capabilities directly from your browser, with no coding or setup required.",Paid,https://www.futurepedia.iohttps://www.futurepedia.io/tool/thinkdiffusion,Design Generators
Ambience,"Transform tabs into inspiring, visually rich workspaces with AI art and quotes.",Free,https://www.futurepedia.iohttps://www.futurepedia.io/tool/ambience,Design Generators
Virtual House Flip,Remodel homes using AI for stunning results,Free Trial,https://www.futurepedia.iohttps://www.futurepedia.io/tool/virtual-house-flip,Design Generators
AI Home Design,Revolutionize real estate and interior design with AI-driven virtual staging and renovations.,Free Trial,https://www.futurepedia.iohttps://www.futurepedia.io/tool/ai-home-design,Design Generators
Airbrush,"AI-driven tool for seamless, professional headshot enhancement.",Active deal,https://www.futurepedia.iohttps://www.futurepedia.io/tool/airbrush,Design Generators
Let's Enhance,"Transform images to 4K quality, enhance, upscale, and correct with AI.",Freemium,https://www.futurepedia.iohttps://www.futurepedia.io/tool/lets-enhance,Design Generators
TattoosAI,"Transform ideas into unique tattoos with AI, offering endless styles and personalization.",Freemium,https://www.futurepedia.iohttps://www.futurepedia.io/tool/tattoosai,Design Generators
Patterned AI,Enhance decision-making with AI-driven pattern recognition and analysis.,Freemium,https://www.futurepedia.iohttps://www.futurepedia.io/tool/patterned-ai,Design Generators
Quickads,"AI-powered, multi-platform ad creation in seconds—cost-effective and user-friendly.",Free Trial,https://www.futurepedia.iohttps://www.futurepedia.io/tool/quickads,Design Generators
GPT Stylist,"Revolutionize design with AI-driven, brand-aligned color palettes for Figma and FigJam.",Paid,https://www.futurepedia.iohttps://www.futurepedia.io/tool/gpt-stylist,Design Generators
Diagram,Transform Figma designs with AI-driven automation and creativity.,Free Trial,https://www.futurepedia.iohttps://www.futurepedia.io/tool/diagram,Design Generators
dotBRAND,AI tool streamlines design project management and client interactions.,Contact for Pricing,https://www.futurepedia.iohttps://www.futurepedia.io/tool/dotbrand,Design Generators
RunDiffusion,"Harness cloud AI for high-quality, versatile image generation.",Free Trial,https://www.futurepedia.iohttps://www.futurepedia.io/tool/rundiffusion,Design Generators
ArchitectGPT,AI-driven tool revolutionizes home design with photorealistic visuals.,Freemium,https://www.futurepedia.iohttps://www.futurepedia.io/tool/architectgpt,Design Generators
Freeflo,Revolutionize visual content with AI-powered image prompt creation.,Free,https://www.futurepedia.iohttps://www.futurepedia.io/tool/freeflo,Design Generators
Kittl,"Empower creativity with AI, templates, and collaboration on a single platform.",Freemium,https://www.futurepedia.iohttps://www.futurepedia.io/tool/kittl,Design Generators
Cutout Pro,"Transform visuals effortlessly: AI-powered editing, enhancement, and art generation.",Free Trial,https://www.futurepedia.iohttps://www.futurepedia.io/tool/cutout-pro,Design Generators
IconlabAI,"Unleash AI to swiftly craft unique, high-quality icons and logos with ease.",Paid,https://www.futurepedia.iohttps://www.futurepedia.io/tool/iconlabai,Design Generators
Ideogram,"Transform text to stunning visuals with AI, enhancing creativity and collaboration.",Free,https://www.futurepedia.iohttps://www.futurepedia.io/tool/ideogram,Design Generators
AI2image,AI creates custom images from English descriptions in seconds.,Free Trial,https://www.futurepedia.iohttps://www.futurepedia.io/tool/ai2image,Design Generators
Creative Fast AID,Generate creative concepts and ideas for your NGO or brand from AI models trained on TRIAD's most awarded campaigns in just minutes.,Free,https://www.futurepedia.iohttps://www.futurepedia.io/tool/creative-fast-aid,Design Generators
PicWish,"Transform images effortlessly with AI: background removal, enhancement, art creation.",Freemium,https://www.futurepedia.iohttps://www.futurepedia.io/tool/picwish,Design Generators
Sivi,"Transforms content into tailored, multilingual visual designs swiftly.",Freemium,https://www.futurepedia.iohttps://www.futurepedia.io/tool/sivi,Design Generators
Dream by WOMBO,Create AI-powered art in seconds with WOMBO Dream.,Freemium,https://www.futurepedia.iohttps://www.futurepedia.io/tool/wombo,Design Generators
Ludo,Revolutionize game development with AI-driven ideation and market insights.,Freemium,https://www.futurepedia.iohttps://www.futurepedia.io/tool/ludo,Design Generators
RoomGPT,Transform any room with AI-driven design from just one photo.,Free Trial,https://www.futurepedia.iohttps://www.futurepedia.io/tool/roomgpt,Design Generators
Typho,"AI-driven artistry: Create stunning, personalized portraits from text.",Free,https://www.futurepedia.iohttps://www.futurepedia.io/tool/typho,Design Generators
Stylar,"Revolutionize design with AI-powered editing, intuitive controls, and high-res outputs.",Free,https://www.futurepedia.iohttps://www.futurepedia.io/tool/stylar,Design Generators
Decktopus AI,"Revolutionize slide creation with AI, saving time and enhancing engagement.",Paid,https://www.futurepedia.iohttps://www.futurepedia.io/tool/decktopus-ai,Design Generators
Charisma,"Revolutionize storytelling with interactive, emotionally intelligent virtual characters.",Contact for Pricing,https://www.futurepedia.iohttps://www.futurepedia.io/tool/charisma,Design Generators
Logopony,"AI-driven, intuitive logo creation with full brand kit options.",Paid,https://www.futurepedia.iohttps://www.futurepedia.io/tool/logopony,Design Generators
The New Black,"Revolutionize fashion design with AI-generated, customizable trends.",Freemium,https://www.futurepedia.iohttps://www.futurepedia.io/tool/the-new-black,Design Generators
Forms.app,"Create Web Forms, Surveys, and Quizzes with Ease",Freemium,https://www.futurepedia.iohttps://www.futurepedia.io/tool/formsapp,Design Generators
CoverDesignAI,"AI-powered tool for effortless, personalized book cover design.",Freemium,https://www.futurepedia.iohttps://www.futurepedia.io/tool/coverdesignai,Design Generators
mnml AI,Transform sketches to detailed renders instantly with AI-powered design magic.,Paid,https://www.futurepedia.iohttps://www.futurepedia.io/tool/mnml-ai,Design Generators
Gencraft,AI-powered tool for creating stunning digital art effortlessly.,Freemium,https://www.futurepedia.iohttps://www.futurepedia.io/tool/gencraft,Design Generators
Virtual Staging AI,Stage Real Estate Images in Seconds with AI,Freemium,https://www.futurepedia.iohttps://www.futurepedia.io/tool/virtual-staging-ai,Design Generators
Cactus Interior,"Revolutionize interior design with AI: instant inspirations, easy visualization, diverse styles.",Paid,https://www.futurepedia.iohttps://www.futurepedia.io/tool/cactus-ai,Design Generators
Remove-BG.AI,Effortlessly strip image backgrounds with AI precision; download in HD.,Freemium,https://www.futurepedia.iohttps://www.futurepedia.io/tool/remove-bg-ai,Design Generators
LogoFast,Turbocharge Your Startup Launch with NextJS Boilerplate,Free,https://www.futurepedia.iohttps://www.futurepedia.io/tool/logofast,Design Generators
Resleeve,"Revolutionize fashion design: AI sketches, virtual shoots, instant edits.",Free Trial,https://www.futurepedia.iohttps://www.futurepedia.io/tool/resleeve,Design Generators
Mobirise AI Website Builder,"Create professional websites easily with AI, no coding required.",Freemium,https://www.futurepedia.iohttps://www.futurepedia.io/tool/mobirise-ai-website-builder,Design Generators
Idesigns,"Unleash creativity with AI-driven design automation, customization, and seamless editing.",Free Trial,https://www.futurepedia.iohttps://www.futurepedia.io/tool/idesigns,Design Generators
Off/Script,"Empower design and earn with AI, community-voted product creation.",Freemium,https://www.futurepedia.iohttps://www.futurepedia.io/tool/offscript,Design Generators
Slazzer,AI tool automates precision image background removal effortlessly.,Free Trial,https://www.futurepedia.iohttps://www.futurepedia.io/tool/slazzer,Design Generators
PromptsIdeas,"Unlock AI creativity: market, monetize, and master generative prompts.",Freemium,https://www.futurepedia.iohttps://www.futurepedia.io/tool/promptsideas,Design Generators
Collov AI,"Transform photos into stunning, realistic design visuals effortlessly.",Free Trial,https://www.futurepedia.iohttps://www.futurepedia.io/tool/collov,Design Generators
Book Witch,Use the power of AI to create complete e-books with just one click!,Free Trial,https://www.futurepedia.iohttps://www.futurepedia.io/tool/book-witch,Design Generators
Sketch2App,Transform sketches to interactive app prototypes.,Free,https://www.futurepedia.iohttps://www.futurepedia.io/tool/sketch2app,Design Generators
Photosonic AI,"Transform text into high-quality, diverse art instantly.",Free Trial,https://www.futurepedia.iohttps://www.futurepedia.io/tool/photosonic-ai,Design Generators
ViralKit,Supercharge social engagement with AI-driven contests and robust integrations.,Freemium,https://www.futurepedia.iohttps://www.futurepedia.io/tool/viralkit,Design Generators
QR Diffusion,"AI transforms QR codes into engaging, custom artistic visuals.",Paid,https://www.futurepedia.iohttps://www.futurepedia.io/tool/qr-diffusion,Design Generators
AICarousels,Create stunning social media carousels with AI-driven ease.,Freemium,https://www.futurepedia.iohttps://www.futurepedia.io/tool/aicarousels,Design Generators
Luminar AI,"Revolutionize photo editing with AI-driven, user-friendly tools.",Paid,https://www.futurepedia.iohttps://www.futurepedia.io/tool/luminar-neo,Design Generators
SofaBrain,"Transform spaces instantly with AI, offering endless design customizations.",Free Trial,https://www.futurepedia.iohttps://www.futurepedia.io/tool/sofabrain,Design Generators
DALL·E 3,Generate stunning images from text with advanced AI technology.,Contact for Pricing,https://www.futurepedia.iohttps://www.futurepedia.io/tool/dall-e-3,Design Generators
Wepik,"Revolutionize design: AI-powered, versatile, user-friendly, for all skill levels.",Free Trial,https://www.futurepedia.iohttps://www.futurepedia.io/tool/wepik,Design Generators
Deep Dream Generator,"Transform images into surreal art with AI, effortlessly blending reality with imagination.",Freemium,https://www.futurepedia.iohttps://www.futurepedia.io/tool/deepdreamgenerator,Design Generators
Flowstep,AI-driven design suggestions and seamless real-time collaboration for creatives.,Contact for Pricing,https://www.futurepedia.iohttps://www.futurepedia.io/tool/flowstep,Design Generators
Artigen Pro AI,"Transform text into realistic images instantly, free and user-friendly.",Free,https://www.futurepedia.iohttps://www.futurepedia.io/tool/artigen-pro-ai,Design Generators
Enzzo,Revolutionize hardware development with AI-driven automation and instant rendering.,Contact for Pricing,https://www.futurepedia.iohttps://www.futurepedia.io/tool/enzzo,Design Generators
Motiff,"Revolutionize design with AI, collaboration, and prototyping tools.",Freemium,https://www.futurepedia.iohttps://www.futurepedia.io/tool/motiff,Design Generators
GEES,"Unleash creativity: AI-powered design, effortless collaboration, infinite possibilities.",Freemium,https://www.futurepedia.iohttps://www.futurepedia.io/tool/gees,Design Generators
Quilter,Automates PCB design with generative AI for rapid prototyping.,Freemium,https://www.futurepedia.iohttps://www.futurepedia.io/tool/quilter,Design Generators
Wegic,"Revolutionize web design: AI-driven, chat-based, versatile, with supportive assistants.",Free Trial,https://www.futurepedia.iohttps://www.futurepedia.io/tool/wegic,Design Generators
Adobe Photoshop,"Master image editing, AI, 3D design, and more.",Paid,https://www.futurepedia.iohttps://www.futurepedia.io/tool/adobe-photoshop,Design Generators
Kitkoo,Transform images into customizable e-commerce products instantly.,Contact for Pricing,https://www.futurepedia.iohttps://www.futurepedia.io/tool/kitkoo,Design Generators
Imagine Anything,Transform text into stunning images effortlessly.,Freemium,https://www.futurepedia.iohttps://www.futurepedia.io/tool/imagine-anything,Design Generators
Plan By,"Transform architectural design with rapid, photorealistic visualization AI.",Free Trial,https://www.futurepedia.iohttps://www.futurepedia.io/tool/plan-by,Design Generators
Sprite Fusion,Create stunning 2D maps effortlessly with seamless engine integration.,Freemium,https://www.futurepedia.iohttps://www.futurepedia.io/tool/sprite-fusion,Design Generators
MolyPix.AI,"Transform text into stunning, editable designs instantly.",Freemium,https://www.futurepedia.iohttps://www.futurepedia.io/tool/molypix-ai,Design Generators
PhotoPacks.AI,"Revolutionize photo management with AI-curated, high-quality, customizable collections.",Paid,https://www.futurepedia.iohttps://www.futurepedia.io/tool/photopacks-ai,Design Generators
ON1 Photo RAW,Elevate photos with AI-powered editing and comprehensive management.,Contact for Pricing,https://www.futurepedia.iohttps://www.futurepedia.io/tool/one-photo-raw,Design Generators
AI Photo Filter,"Revolutionize image editing: intuitive AI, precise layering, sketching, high-res exports.",Freemium,https://www.futurepedia.iohttps://www.futurepedia.io/tool/ai-photo-filter,Design Generators
Deblank,AI-driven tool transforming creative design with innovative suggestions.,Free,https://www.futurepedia.iohttps://www.futurepedia.io/tool/deblank,Design Generators
Shopify Logo Maker,Effortlessly create professional logos with customizable templates.,Free,https://www.futurepedia.iohttps://www.futurepedia.io/tool/shopify-logo-maker,Design Generators
Skippr,"Revolutionize design with AI-generated, editable, rapid layouts.",Contact for Pricing,https://www.futurepedia.iohttps://www.futurepedia.io/tool/skippr,Design Generators
FLUX.1,"AI-driven tool for exceptional, high-quality image generation.",Freemium,https://www.futurepedia.iohttps://www.futurepedia.io/tool/flux1,Design Generators
AI Character Generator,"Streamline storyboard creation with AI-generated characters, ensuring consistency and professional quality.",Paid,https://www.futurepedia.iohttps://www.futurepedia.io/tool/ai-character-generator,Design Generators
Google Imagen 3,Revolutionizes photorealism in AI-generated images with deep language understanding.,Free,https://www.futurepedia.iohttps://www.futurepedia.io/tool/google-imagen-3,Design Generators
Magic Write,"Transform content creation with AI, integrated seamlessly with Canva's design tools.",Freemium,https://www.futurepedia.iohttps://www.futurepedia.io/tool/magic-write-canva,Design Generators
Astrocade,"Unlock game creation for all with AI-driven design, rapid development, and community collaboration.",Contact for Pricing,https://www.futurepedia.iohttps://www.futurepedia.io/tool/astrocade,Design Generators
ArkDesign,"AI-driven platform for optimized, compliant architectural design and feasibility studies.",Contact for Pricing,https://www.futurepedia.iohttps://www.futurepedia.io/tool/arkdesign,Design Generators
PixMaker AI,AI-driven tool transforms design with seamless image editing.,Free Trial,https://www.futurepedia.iohttps://www.futurepedia.io/tool/pixmaker-ai,Design Generators
Thumbmachine,Create stunning YouTube video thumbnails effortlessly.,Paid,https://www.futurepedia.iohttps://www.futurepedia.io/tool/thumbmachine,Design Generators
magify.design,AI-driven design automation for stunning visual content creation.,Free,https://www.futurepedia.iohttps://www.futurepedia.io/tool/magify-design,Design Generators
Ablo,"Transform fashion ideas into trendy, AI-powered designs effortlessly.",Paid,https://www.futurepedia.iohttps://www.futurepedia.io/tool/ablo,Design Generators
SlideTeam AI Presentation Generator,Revolutionize slide creation with AI-driven design and collaboration.,Paid,https://www.futurepedia.iohttps://www.futurepedia.io/tool/slideteam-ai-presentation-generator,Design Generators
Real-Time Design By Collov,AI-driven tool for real-time virtual staging and design.,Freemium,https://www.futurepedia.iohttps://www.futurepedia.io/tool/real-time-design-collov,Design Generators
Series AI,"Empower game development with AI, fostering creativity, efficiency, and community collaboration.",Contact for Pricing,https://www.futurepedia.iohttps://www.futurepedia.io/tool/series-ai,Design Generators
PaintShop Pro,Transform photos and designs with AI-enhanced editing tools.,Paid,https://www.futurepedia.iohttps://www.futurepedia.io/tool/paintshoppro,Design Generators
Inhabitr,"AI-driven furniture solutions for effortless, stylish space transformations.",Contact for Pricing,https://www.futurepedia.iohttps://www.futurepedia.io/tool/inhabitr,Design Generators
