Tool Name,Summary,Pricing,Link,Category
Luma AI,"Transform text into detailed 3D models, interact with dynamic scenes.",Contact for Pricing,https://www.futurepedia.iohttps://www.futurepedia.io/tool/luma-ai,3D Generator
Kaedim,Transform 2D images into high-quality 3D models quickly and efficiently.,Paid,https://www.futurepedia.iohttps://www.futurepedia.io/tool/kaedim,3D Generator
Pixela AI,Enhance and analyze images with AI-driven precision and scalability.,Free,https://www.futurepedia.iohttps://www.futurepedia.io/tool/pixela-ai,3D Generator
Kinetix,"Revolutionize 3D animation with AI, democratizing creation for all.",Paid,https://www.futurepedia.iohttps://www.futurepedia.io/tool/kinetix,3D Generator
InteriorAI,Revolutionize interior design with AI: instant photorealistic renders and virtual staging.,Free Trial,https://www.futurepedia.iohttps://www.futurepedia.io/tool/interiorai,3D Generator
GET3D by NVIDIA,"Revolutionize 3D modeling with AI-powered, texture-rich model creation.",Free,https://www.futurepedia.iohttps://www.futurepedia.io/tool/get3d-nvidia,3D Generator
GetFloorPlan,"AI-driven tool for quick, detailed, and customizable floor plans.",Freemium,https://www.futurepedia.iohttps://www.futurepedia.io/tool/getfloorplan,3D Generator
Avaturn,Create lifelike 3D avatars from selfies with extensive customization.,Freemium,https://www.futurepedia.iohttps://www.futurepedia.io/tool/avaturn,3D Generator
DeepMotion,Revolutionize animation with AI-driven motion capture and body tracking for all creators.,Freemium,https://www.futurepedia.iohttps://www.futurepedia.io/tool/deepmotion,3D Generator
Meshy,"Revolutionize 3D creation: AI-powered, text/image to model, rapid texturing, diverse export options.",Freemium,https://www.futurepedia.iohttps://www.futurepedia.io/tool/meshy,3D Generator
Leonardo.Ai,"Revolutionize AI interaction: intuitive, secure, cross-platform access, enhancing productivity.",Freemium,https://www.futurepedia.iohttps://www.futurepedia.io/tool/leonardoai,3D Generator
Ponzu,Revolutionize 3D texturing with AI for photorealistic effects and efficiency.,Free,https://www.futurepedia.iohttps://www.futurepedia.io/tool/ponzu,3D Generator
Scenario,AI-driven game asset creation with unmatched style consistency and efficiency.,Freemium,https://www.futurepedia.iohttps://www.futurepedia.io/tool/scenario,3D Generator
Wonder Studio,"Revolutionize VFX: automate animation, lighting, composition in your browser.",Freemium,https://www.futurepedia.iohttps://www.futurepedia.io/tool/wonder-studio,3D Generator
Immersity AI,Transform 2D images and videos into immersive 3D experiences.,Freemium,https://www.futurepedia.iohttps://www.futurepedia.io/tool/immersity-ai,3D Generator
PrometheanAI,Revolutionize digital art with AI-driven asset management and world building.,Freemium,https://www.futurepedia.iohttps://www.futurepedia.io/tool/prometheanai,3D Generator
3DFY,Revolutionize 3D model creation with AI: Text descriptions to detailed assets.,Free,https://www.futurepedia.iohttps://www.futurepedia.io/tool/3dfy,3D Generator
Plask,"Revolutionize 3D animation with AI-powered, user-friendly motion capture.",Freemium,https://www.futurepedia.iohttps://www.futurepedia.io/tool/plask,3D Generator
Alpha3D,Alpha3D is a revolutionary generative AI-powered platform that transforms 2D images into high-quality 3D assets at scale.,Free Trial,https://www.futurepedia.iohttps://www.futurepedia.io/tool/alpha3d,3D Generator
Polyhive,"Revolutionize 3D modeling with AI, intuitive design, and real-time collaboration.",Contact for Pricing,https://www.futurepedia.iohttps://www.futurepedia.io/tool/polyhive,3D Generator
Sloyd,"Revolutionize 3D model creation with AI, no experience needed.",Contact for Pricing,https://www.futurepedia.iohttps://www.futurepedia.io/tool/sloyd,3D Generator
CSM,"Transform photos, text, sketches into immersive 3D worlds with AI.",Freemium,https://www.futurepedia.iohttps://www.futurepedia.io/tool/csm,3D Generator
Finch 3D,AI-driven platform enhances architectural design creativity and efficiency.,Contact for Pricing,https://www.futurepedia.iohttps://www.futurepedia.io/tool/finch-3d,3D Generator
Move AI,"Transforms 2D video to 3D motion data, enabling markerless motion capture.",Contact for Pricing,https://www.futurepedia.iohttps://www.futurepedia.io/tool/moveai,3D Generator
Swapp,Revolutionize architectural documentation with AI-powered automation and bespoke integration.,Contact for Pricing,https://www.futurepedia.iohttps://www.futurepedia.io/tool/swapp,3D Generator
Rokoko Video,Transform video to 3D animations easily with AI-driven mocap technology.,Contact for Pricing,https://www.futurepedia.iohttps://www.futurepedia.io/tool/rokoko-video,3D Generator
Blockode AI Photo Studio,Generate immersive 360° worlds from text or sketches with advanced customization.,Paid,https://www.futurepedia.iohttps://www.futurepedia.io/tool/blockode-ai-photo-studio,3D Generator
Spline AI,"Revolutionize 3D design with AI: create, edit, collaborate effortlessly.",Freemium,https://www.futurepedia.iohttps://www.futurepedia.io/tool/spline-ai,3D Generator
Autodesk Forma,AI-powered platform streamlining AEC design and collaboration.,Paid,https://www.futurepedia.iohttps://www.futurepedia.io/tool/autodesk-forma,3D Generator
Atlas Design,Revolutionizes 3D content creation with AI-driven efficiency and quality.,Contact for Pricing,https://www.futurepedia.iohttps://www.futurepedia.io/tool/atlas-design,3D Generator
Product Design Studio,Transform sketches to 3D designs and collaborate efficiently with AI.,Free Trial,https://www.futurepedia.iohttps://www.futurepedia.io/tool/product-design-studio,3D Generator
Masterpiece X,"Revolutionize 3D modeling: AI-driven, VR-ready, unlimited creative potential.",Free Trial,https://www.futurepedia.iohttps://www.futurepedia.io/tool/masterpiece-x,3D Generator
Loci,"Revolutionizes 3D asset management with rapid, precise AI-driven tagging.",Free Trial,https://www.futurepedia.iohttps://www.futurepedia.io/tool/loci,3D Generator
Polycam,Transform spaces into 3D models with LiDAR and photogrammetry.,Free Trial,https://www.futurepedia.iohttps://www.futurepedia.io/tool/polycam,3D Generator
Sortium,"Revolutionize 3D asset creation with real-time, API-driven tools.",Contact for Pricing,https://www.futurepedia.iohttps://www.futurepedia.io/tool/sortium,3D Generator
Snaptrude,Collaborative browser-based BIM for architects and interior designers.,Contact for Pricing,https://www.futurepedia.iohttps://www.futurepedia.io/tool/snaptrude,3D Generator
Assemblio,Transform CAD models into interactive assembly instructions effortlessly.,Contact for Pricing,https://www.futurepedia.iohttps://www.futurepedia.io/tool/assemblio,3D Generator
Yellow,"Revolutionize 3D modeling: AI-driven, animation-ready, collaborative.",Contact for Pricing,https://www.futurepedia.iohttps://www.futurepedia.io/tool/yellow,3D Generator
QuickMagic,"AI-driven tool for precise, real-time human motion capture.",Freemium,https://www.futurepedia.iohttps://www.futurepedia.io/tool/quickmagic,3D Generator
Playbook,Seamlessly create dynamic 3D scenes with ComfyUI integration.,Contact for Pricing,https://www.futurepedia.iohttps://www.futurepedia.io/tool/playbook,3D Generator
Hypothetic,Revolutionize 3D/2D asset management and collaboration with AI-powered cloud tools.,Contact for Pricing,https://www.futurepedia.iohttps://www.futurepedia.io/tool/hypothetic,3D Generator
Graswald,Transform natural environments with precise 3D assets and dynamic effects.,Contact for Pricing,https://www.futurepedia.iohttps://www.futurepedia.io/tool/graswald,3D Generator
SKY ENGINE AI,Revolutionize AI with virtual training on photorealistic synthetic data.,Contact for Pricing,https://www.futurepedia.iohttps://www.futurepedia.io/tool/sky-engine-ai,3D Generator
Skybox Lab,Create immersive 360° virtual worlds effortlessly with text prompts.,Free,https://www.futurepedia.iohttps://www.futurepedia.io/tool/skybox-lab,3D Generator
G3DAI {Jedi},"Revolutionize game development: create, design, play—effortlessly.",Contact for Pricing,https://www.futurepedia.iohttps://www.futurepedia.io/tool/g3dai-jedi,3D Generator
Draw3D,Transforms sketches into photorealistic images with versatile editing.,Freemium,https://www.futurepedia.iohttps://www.futurepedia.io/tool/draw3d,3D Generator
Masterpiece Studio,"Revolutionize 3D creation: intuitive, collaborative, VR-enabled.",Freemium,https://www.futurepedia.iohttps://www.futurepedia.io/tool/masterpiece-studio,3D Generator
Replicate Codex,"A free tool to search, filter, sort, and discover AI models",Free,https://www.futurepedia.iohttps://www.futurepedia.io/tool/replicate-codex,3D Generator
Homestyler AI,Exclusive interior design tool that brings users' unique design ideas to life.,Freemium,https://www.futurepedia.iohttps://www.futurepedia.io/tool/homestyler-ai,3D Generator
Texture Lab,"Transform text into detailed, seamless textures effortlessly.",Free Trial,https://www.futurepedia.iohttps://www.futurepedia.io/tool/texture-lab,3D Generator
OpalAi,Floor plans & 3D visuals for real estate & construction.,Paid,https://www.futurepedia.iohttps://www.futurepedia.io/tool/opalai,3D Generator
Tripo,Automate and enhance 3D modeling with AI-driven precision.,Freemium,https://www.futurepedia.iohttps://www.futurepedia.io/tool/tripo,3D Generator
Leo,Transforms sketches to optimized 3D CAD models via AI.,Free Trial,https://www.futurepedia.iohttps://www.futurepedia.io/tool/leo,3D Generator
Glyf,Intuitive interface enables 3D mobile design.,Freemium,https://www.futurepedia.iohttps://www.futurepedia.io/tool/glyf,3D Generator
CodeBaby,Revolutionize customer engagement with emotionally intelligent AI avatars.,Free Trial,https://www.futurepedia.iohttps://www.futurepedia.io/tool/codebaby,3D Generator
Tafi Avatar,"AI-powered tool for rapid, high-quality 3D character creation.",Contact for Pricing,https://www.futurepedia.iohttps://www.futurepedia.io/tool/tafi-avatar,3D Generator
Blimeycreate,"Blimey is an AI image generator that empowers users to create high-quality images, illustrations, art, graphics, covers, and comics with ease",Paid,https://www.futurepedia.iohttps://www.futurepedia.io/tool/blimeycreate,3D Generator
Unity,"Craft interactive, dynamic 3D content for AR, VR, mobile, desktop, and web platforms.",Contact for Pricing,https://www.futurepedia.iohttps://www.futurepedia.io/tool/unity,3D Generator
3DAiLY,Unleash AI-driven 3D model creation with artist refinement for game-ready characters and a collaborative marketplace.,Freemium,https://www.futurepedia.iohttps://www.futurepedia.io/tool/3daily,3D Generator
MagiScan,Capture and convert real-world objects into 3D models effortlessly.,Free Trial,https://www.futurepedia.iohttps://www.futurepedia.io/tool/magiscan,3D Generator
items,"Revolutionize digital design with AI-generated, versatile, and free-to-use creative assets.",Freemium,https://www.futurepedia.iohttps://www.futurepedia.io/tool/items,3D Generator
Rapport,"Create emotionally intelligent, multilingual, customizable AI characters.",Free Trial,https://www.futurepedia.iohttps://www.futurepedia.io/tool/rapport,Ai Agents
AutoGPT,Automate workflows with customizable AI agents seamlessly.,Free,https://www.futurepedia.iohttps://www.futurepedia.io/tool/auto-gpt,Ai Agents
AgentVerse,"Explore, create, manage AI agents effortlessly; enhance efficiency, cut costs.",Contact for Pricing,https://www.futurepedia.iohttps://www.futurepedia.io/tool/agentverse,Ai Agents
Baby AGI,Develop autonomous AI agents with self-building and task planning.,Free,https://www.futurepedia.iohttps://www.futurepedia.io/tool/baby-agi,Ai Agents
AgentX,"Enhance customer engagement with intelligent, customizable AI chatbots.",Freemium,https://www.futurepedia.iohttps://www.futurepedia.io/tool/agentx,Ai Agents
AgentGPT,Automate complex web tasks with customizable AI agents.,Freemium,https://www.futurepedia.iohttps://www.futurepedia.io/tool/agentgpt,Ai Agents
MySports AI,"AI-driven sports betting insights for strategic, profitable wagers.",Free Trial,https://www.futurepedia.iohttps://www.futurepedia.io/tool/mysports-ai,Ai Agents
CustomGPT.ai,Cut Support Costs in Half with AI that Auto-Resolves 93% of Questions,Active deal,https://www.futurepedia.iohttps://www.futurepedia.io/tool/customgpt,Ai Agents
Stratup.ai,"Revolutionize startup ideation with AI-driven, market-trend savvy, personalized idea generation.",Free,https://www.futurepedia.iohttps://www.futurepedia.io/tool/stratupai,Ai Agents
Inworld,"Elevate game development with dynamic NPCs, immersive worlds, and AI-driven content creation.",Freemium,https://www.futurepedia.iohttps://www.futurepedia.io/tool/inworld,Ai Agents
Circleback.ai,"Streamline meeting notes and action items with AI, ensuring efficiency and data security.",Free Trial,https://www.futurepedia.iohttps://www.futurepedia.io/tool/circlebackai,Ai Agents
Olympia,"AI consultants simplify business tasks, enhance productivity, cut costs.",Paid,https://www.futurepedia.iohttps://www.futurepedia.io/tool/olympia,Ai Agents
Coinfeeds,AI-driven insights revolutionize cryptocurrency and stock data analysis.,Contact for Pricing,https://www.futurepedia.iohttps://www.futurepedia.io/tool/coinfeeds,Ai Agents
Cognosys,"Optimize workflows, automate tasks, enhance productivity with AI.",Freemium,https://www.futurepedia.iohttps://www.futurepedia.io/tool/cognosys,Ai Agents
GPTConsole,Revolutionize app development with AI agents for seamless automation.,Free Trial,https://www.futurepedia.iohttps://www.futurepedia.io/tool/gptconsole,Ai Agents
Clevis,"Unleash AI app development and monetization, no coding required—build, integrate, automate, and sell.",Free Trial,https://www.futurepedia.iohttps://www.futurepedia.io/tool/clevis,Ai Agents
Cheat Layer,AI platform automating business tasks for enhanced efficiency.,Free Trial,https://www.futurepedia.iohttps://www.futurepedia.io/tool/cheat-layer,Ai Agents
Stammer,Empowers agencies to create and offer customized AI-powered solutions to their clients.,Free Trial,https://www.futurepedia.iohttps://www.futurepedia.io/tool/stammer,Ai Agents
Role Model AI,"Virtual assistant with 3D avatars, phone integration, and Fortnite connectivity.",Freemium,https://www.futurepedia.iohttps://www.futurepedia.io/tool/rolemodel-ai,Ai Agents
Setter AI,"Revolutionizes lead engagement with AI, boosting conversions and personalizing calls at scale.",Contact for Pricing,https://www.futurepedia.iohttps://www.futurepedia.io/tool/setter-ai,Ai Agents
MailMaestro,Boost email drafting speed and security with AI-driven personalization.,Free Trial,https://www.futurepedia.iohttps://www.futurepedia.io/tool/mailmaestro,Ai Agents
MindStudio,"Unlock AI's potential: analytics, creativity, efficiency, in an intuitive, customizable platform.",Freemium,https://www.futurepedia.iohttps://www.futurepedia.io/tool/mindstudio,Ai Agents
TheLoops,"Revolutionize CX operations with AI-driven insights, proactive tools, and seamless integrations.",Free Trial,https://www.futurepedia.iohttps://www.futurepedia.io/tool/theloops,Ai Agents
SuperAGI Cloud,Streamline complex workflows with advanced AI automation platform.,Free,https://www.futurepedia.iohttps://www.futurepedia.io/tool/superagi-cloud,Ai Agents
Convai,"Elevate virtual worlds with AI-driven, interactive, and knowledgeable characters.",Freemium,https://www.futurepedia.iohttps://www.futurepedia.io/tool/convai,Ai Agents
AvanazAI,"Streamlines investment operations with AI, real-time insights, automation.",Contact for Pricing,https://www.futurepedia.iohttps://www.futurepedia.io/tool/avanazai,Ai Agents
Adept,Automate complex workflows with precision using agentic AI.,Contact for Pricing,https://www.futurepedia.iohttps://www.futurepedia.io/tool/adept,Ai Agents
iPlan.ai,"AI-driven, personalized travel itineraries at your fingertips.",Free Trial,https://www.futurepedia.iohttps://www.futurepedia.io/tool/iplan-ai,Ai Agents
Lindy AI,"Automate workflows, integrate systems, no-code AI creation.",Freemium,https://www.futurepedia.iohttps://www.futurepedia.io/tool/lindyai,Ai Agents
HeyMilo AI,Revolutionize hiring with AI-driven automated voice interviews.,Contact for Pricing,https://www.futurepedia.iohttps://www.futurepedia.io/tool/heymilo,Ai Agents
TheGist,"Revolutionize workflow with AI-driven, secure, unified workspace.",Freemium,https://www.futurepedia.iohttps://www.futurepedia.io/tool/thegist,Ai Agents
Nabla,"Automated clinical note generation, seamless EHR integration, and HIPAA-compliant documentation streamline healthcare workflows effortlessly.""",Freemium,https://www.futurepedia.iohttps://www.futurepedia.io/tool/nabla,Ai Agents
Simple Phones,"Revolutionize business calls with AI, ensuring no customer is missed.",Free Trial,https://www.futurepedia.iohttps://www.futurepedia.io/tool/simple-phones,Ai Agents
Marketing Strategy Generator,Unleash tailored marketing strategies in minutes with AI-driven insights and user-friendly templates.,Paid,https://www.futurepedia.iohttps://www.futurepedia.io/tool/marketing-strategy-generator,Ai Agents
Relevance AI,"Empower growth with AI: streamline operations, enhance output, no-code, LLM-flexible.",Freemium,https://www.futurepedia.iohttps://www.futurepedia.io/tool/relevance-ai,Ai Agents
Beloga,"Elevates teamwork with AI insights, seamless app integration, and real-time data unification.",Free,https://www.futurepedia.iohttps://www.futurepedia.io/tool/beloga,Ai Agents
Mindsera,"Revolutionize personal growth with AI journaling, mentorship, and cognitive insights.",Freemium,https://www.futurepedia.iohttps://www.futurepedia.io/tool/mindsera,Ai Agents
Lutra AI,Automate complex workflows seamlessly with AI-driven efficiency.,Contact for Pricing,https://www.futurepedia.iohttps://www.futurepedia.io/tool/lutra-ai,Ai Agents
Wellpin,"Streamlines scheduling with AI, calendar sync, and personalized links.",Free,https://www.futurepedia.iohttps://www.futurepedia.io/tool/wellpin,Ai Agents
Sonara,Revolutionizes job search with AI-driven automated applications and personalized matches.,Free Trial,https://www.futurepedia.iohttps://www.futurepedia.io/tool/sonara,Ai Agents
Tulsk.io,Revolutionize teamwork with AI-driven project management and seamless collaboration.,Free,https://www.futurepedia.iohttps://www.futurepedia.io/tool/tulskio,Ai Agents
LlamaIndex,Transform enterprise data into powerful LLM applications effortlessly.,Contact for Pricing,https://www.futurepedia.iohttps://www.futurepedia.io/tool/llamaindex,Ai Agents
Brightbid,AI-driven PPC automation optimizes ads and competitor monitoring.,Contact for Pricing,https://www.futurepedia.iohttps://www.futurepedia.io/tool/brightbid,Ai Agents
Dart,"Transform workflows with AI: intuitive, customizable, seamlessly integrated.",Freemium,https://www.futurepedia.iohttps://www.futurepedia.io/tool/dart,Ai Agents
Shield AI,"Autonomous AI pilots revolutionize aviation, enhancing safety and efficiency.",Free,https://www.futurepedia.iohttps://www.futurepedia.io/tool/shield-ai,Ai Agents
Ask Layla,Revolutionize travel with AI-driven planning and seamless bookings.,Free,https://www.futurepedia.iohttps://www.futurepedia.io/tool/ask-layla,Ai Agents
Hebbia,"Revolutionize document analysis: AI collaboration, transparency, vast data handling.",Contact for Pricing,https://www.futurepedia.iohttps://www.futurepedia.io/tool/hebbia,Ai Agents
Dashworks,"Centralize enterprise knowledge with AI-powered, secure, and easily integrated answers.",Paid,https://www.futurepedia.iohttps://www.futurepedia.io/tool/dashworks,Ai Agents
Replicate,"Unlock AI's potential: run, fine-tune, deploy models easily and cost-effectively.",Paid,https://www.futurepedia.iohttps://www.futurepedia.io/tool/replicate,Ai Agents
Aporia,"Real-time AI security and compliance for robust, reliable applications.",Freemium,https://www.futurepedia.iohttps://www.futurepedia.io/tool/aporia,Ai Agents
CulturePulse AI,AI-driven tool for risk-free strategy testing with digital twins.,Freemium,https://www.futurepedia.iohttps://www.futurepedia.io/tool/culturepulse-ai,Ai Agents
Freed,"Revolutionize healthcare documentation: AI scribe, real-time, HIPAA-compliant, EHR-integrated.",Free Trial,https://www.futurepedia.iohttps://www.futurepedia.io/tool/freed,Ai Agents
Arya.ai,Revolutionize banking and insurance with AI-driven efficiency and security.,Contact for Pricing,https://www.futurepedia.iohttps://www.futurepedia.io/tool/arya-ai,Ai Agents
Sapien,"Human-augmented AI data labeling for scalable, high-quality training.",Contact for Pricing,https://www.futurepedia.iohttps://www.futurepedia.io/tool/sapien,Ai Agents
ActiveLoop.ai,"Revolutionize AI data management: faster, scalable, efficient.",Freemium,https://www.futurepedia.iohttps://www.futurepedia.io/tool/activeloop-ai,Ai Agents
EnCharge AI,"Revolutionizing AI efficiency, sustainability, and deployment flexibility.",Contact for Pricing,https://www.futurepedia.iohttps://www.futurepedia.io/tool/encharge-ai,Ai Agents
Knostic,"Secure, tailored access control for large language models.",Contact for Pricing,https://www.futurepedia.iohttps://www.futurepedia.io/tool/knostic,Ai Agents
Hirevue,"Transform hiring: AI-driven video interviews, global candidate reach.",Contact for Pricing,https://www.futurepedia.iohttps://www.futurepedia.io/tool/hirevue,Ai Agents
Speaksage,Transform leadership with AI-driven conversational practice and feedback.,Contact for Pricing,https://www.futurepedia.iohttps://www.futurepedia.io/tool/speaksage,Ai Agents
Datamatics,"AI-driven automation, data analytics, and digital transformation solutions.",Contact for Pricing,https://www.futurepedia.iohttps://www.futurepedia.io/tool/datamatics,Ai Agents
Tektonic AI,Streamline sales and revenue operations with advanced AI-driven automation.,Contact for Pricing,https://www.futurepedia.iohttps://www.futurepedia.io/tool/tektonic-ai,Ai Agents
Celigo,Streamline operations with AI-driven integration and automation.,Contact for Pricing,https://www.futurepedia.iohttps://www.futurepedia.io/tool/celigo,Ai Agents
Refraction AI,Autonomous robots optimize urban delivery logistics efficiently.,Free Trial,https://www.futurepedia.iohttps://www.futurepedia.io/tool/refraction-ai,Ai Agents
TaxGPT,"Revolutionary AI-driven, error-reducing tax filing assistant.",Contact for Pricing,https://www.futurepedia.iohttps://www.futurepedia.io/tool/taxgpt,Ai Agents
BigPanda,AI-driven IT incident automation and correlation tool.,Contact for Pricing,https://www.futurepedia.iohttps://www.futurepedia.io/tool/bigpanda,Ai Agents
Banana,"Seamlessly scale GPU resources with transparent, efficient AI management.",Paid,https://www.futurepedia.iohttps://www.futurepedia.io/tool/banana,Ai Agents
BMC Helix,Streamline IT management with AI-driven insights and workflow automation.,Contact for Pricing,https://www.futurepedia.iohttps://www.futurepedia.io/tool/bmc-helix,Ai Agents
Tensorplex,"Revolutionizing AI with decentralized networks, liquid staking, and Web3 applications.",Contact for Pricing,https://www.futurepedia.iohttps://www.futurepedia.io/tool/tensorplex,Ai Agents
Kusho,"Revolutionizes API testing with AI-generated suites, enhancing developer efficiency and software reliability.",Contact for Pricing,https://www.futurepedia.iohttps://www.futurepedia.io/tool/kusho,Ai Agents
Together AI,"Build, deploy, and optimize AI models with ultra-fast, scalable solutions.",Contact for Pricing,https://www.futurepedia.iohttps://www.futurepedia.io/tool/together-ai,Ai Agents
Hailo,Unleash real-time AI processing at the edge with Hailo.,Contact for Pricing,https://www.futurepedia.iohttps://www.futurepedia.io/tool/hailo,Ai Agents
Pega Systems,AI-driven decisioning and workflow automation for enterprise efficiency.,Contact for Pricing,https://www.futurepedia.iohttps://www.futurepedia.io/tool/pega-systems,Ai Agents
Agentic,"Revolutionize game development with scalable, intuitive AI integration and insights.",Contact for Pricing,https://www.futurepedia.iohttps://www.futurepedia.io/tool/agentic,Ai Agents
RunSybil,"Revolutionize cybersecurity: AI-driven, rapid, accurate pentesting tool.",Contact for Pricing,https://www.futurepedia.iohttps://www.futurepedia.io/tool/runsybil,Ai Agents
Automaited,"Automates order processing, ensuring accuracy and efficiency.",Contact for Pricing,https://www.futurepedia.iohttps://www.futurepedia.io/tool/automaited,Ai Agents
Azara,Revolutionize enterprise workflows with AI-driven automation and integration.,Free Trial,https://www.futurepedia.iohttps://www.futurepedia.io/tool/azara,Ai Agents
Minion AI,"Revolutionize customer service with intelligent, automated, omnichannel support.",Contact for Pricing,https://www.futurepedia.iohttps://www.futurepedia.io/tool/minion-ai,Ai Agents
Crux,"AI-driven agents for instant, customizable business insights and security.",Contact for Pricing,https://www.futurepedia.iohttps://www.futurepedia.io/tool/crux,Ai Agents
PublicAI,"Revolutionize Web3 data management with AI-driven, secure blockchain integration.",Contact for Pricing,https://www.futurepedia.iohttps://www.futurepedia.io/tool/publicai,Ai Agents
Blue Prism,AI-driven automation platform streamlining enterprise operations efficiently.,Contact for Pricing,https://www.futurepedia.iohttps://www.futurepedia.io/tool/blue-prism,Ai Agents
Fieldguide,"Revolutionize audit, advisory with AI-driven efficiency and automation.",Contact for Pricing,https://www.futurepedia.iohttps://www.futurepedia.io/tool/fieldguide,Ai Agents
Indicium Tech,"Transform raw data into actionable, industry-specific insights.",Contact for Pricing,https://www.futurepedia.iohttps://www.futurepedia.io/tool/indicium-tech,Ai Agents
Jamix,"Streamline tasks, secure data across all apps.",Contact for Pricing,https://www.futurepedia.iohttps://www.futurepedia.io/tool/jamix,Ai Agents
Dropzone,"Autonomous AI investigates security alerts, enhancing SOC efficiency.",Paid,https://www.futurepedia.iohttps://www.futurepedia.io/tool/dropzone,Ai Agents
