Tool Name,Summary,Pricing,Link,Category
Slated,"Revolutionize finance with AI-driven modeling, real-time insights, risk assessment.",Free,https://www.futurepedia.iohttps://www.futurepedia.io/tool/slated,Personal Assistant
AIChatting,Aichatting.net allows you to talk to AI chatbots about anything or interact with various AI characters.,Free,https://www.futurepedia.iohttps://www.futurepedia.io/tool/aichatting,Personal Assistant
Plicanta,"Transform resumes into dynamic, trackable portfolio websites.",Free Trial,https://www.futurepedia.iohttps://www.futurepedia.io/tool/plicanta,Personal Assistant
Hedy,AI-powered meeting tool offering real-time insights and summaries.,Freemium,https://www.futurepedia.iohttps://www.futurepedia.io/tool/hedy,Personal Assistant
Ruru,"Revolutionize pet care with AI-driven, real-time advice.",Freemium,https://www.futurepedia.iohttps://www.futurepedia.io/tool/ruru,Personal Assistant
Tomorrow IO,"Enhance decision-making with hyper-accurate, AI-driven weather insights.",Contact for Pricing,https://www.futurepedia.iohttps://www.futurepedia.io/tool/tomorrow-io,Personal Assistant
Canyon,"AI resumes, one-click applications, mock interviews, and application tracking in one place.",Freemium,https://www.futurepedia.iohttps://www.futurepedia.io/tool/canyon,Personal Assistant
Dewey,Dewey is an AI-powered accountability buddy that helps users stay organized and productive.,Free,https://www.futurepedia.iohttps://www.futurepedia.io/tool/dewey,Personal Assistant
AutoEasy,"Simplify Car Buying with AutoEasy | Your 24/7 AI Car Buying Assistant, Personalized to Your Needs",Free,https://www.futurepedia.iohttps://www.futurepedia.io/tool/autoeasy,Personal Assistant
Auri AI,Transform content creation and analytics with AI-driven insights.,Free Trial,https://www.futurepedia.iohttps://www.futurepedia.io/tool/auri-ai,Personal Assistant
Sona,Sona is an innovative AI-driven tool to provide personalized recommendations tailored to your reading preferences.,Free,https://www.futurepedia.iohttps://www.futurepedia.io/tool/sona,Personal Assistant
LightPDF AI,"Revolutionize document management: chat, summarize, analyze with AI-powered precision.",Paid,https://www.futurepedia.iohttps://www.futurepedia.io/tool/lightpdf-ai,Personal Assistant
Vibrato,"Automate calls, manage tasks, save time with AI.",Free,https://www.futurepedia.iohttps://www.futurepedia.io/tool/vibrato,Personal Assistant
Insula,"Transform interaction with real-time, intuitive AI communication.",Free Trial,https://www.futurepedia.iohttps://www.futurepedia.io/tool/insula,Personal Assistant
Besty AI,Transform WhatsApp chats with AI-driven multilingual support and image analysis.,Freemium,https://www.futurepedia.iohttps://www.futurepedia.io/tool/besty-ai,Personal Assistant
Seance AI,Connect with passed loved ones via seance.,Freemium,https://www.futurepedia.iohttps://www.futurepedia.io/tool/seance-ai,Personal Assistant
SplitJoin,"Revolutionize data handling: split, join, process in real-time, AI-powered.",Free,https://www.futurepedia.iohttps://www.futurepedia.io/tool/splitjoin,Personal Assistant
Assisterr,"Boost productivity with AI: task management, data insights, customizable, integrates widely.",Contact for Pricing,https://www.futurepedia.iohttps://www.futurepedia.io/tool/assisterr,Personal Assistant
Gnbly,Revolutionize call management with AI-driven automation and detailed reporting.,Paid,https://www.futurepedia.iohttps://www.futurepedia.io/tool/gnbly,Personal Assistant
Signapse,Signapse AI | Breaking Barriers with our AI Sign Language Translator,Contact for Pricing,https://www.futurepedia.iohttps://www.futurepedia.io/tool/signapse,Personal Assistant
Amazon Bedrock,"Unlock AI innovation: integrate, scale, and customize effortlessly.",Contact for Pricing,https://www.futurepedia.iohttps://www.futurepedia.io/tool/amazon-bedrock,Personal Assistant
Chandu,"Revolutionize digital tasks and communication with intuitive, customizable AI automation.",Free,https://www.futurepedia.iohttps://www.futurepedia.io/tool/chandu,Personal Assistant
TimeMaster,"Boost productivity with automatic, private, insightful time tracking.",Paid,https://www.futurepedia.iohttps://www.futurepedia.io/tool/timemaster,Personal Assistant
FoodAI,AI-powered tool generating personalized recipes from available ingredients.,Free Trial,https://www.futurepedia.iohttps://www.futurepedia.io/tool/foodai,Personal Assistant
Genius PDF,"Transform PDFs with AI: comprehend, translate, store securely.",Freemium,https://www.futurepedia.iohttps://www.futurepedia.io/tool/genius-pdf,Personal Assistant
Marcus Aurelius AI,Stoic philosophy chatbot mentorship.,Freemium,https://www.futurepedia.iohttps://www.futurepedia.io/tool/marcus-aurelius-ai,Personal Assistant
DailyBot AI,Streamline team communication and enhance productivity effortlessly.,Freemium,https://www.futurepedia.iohttps://www.futurepedia.io/tool/dailybot-ai,Personal Assistant
AI Diary,"Revolutionize journaling with AI: mood tracking, voice interaction, secure.",Freemium,https://www.futurepedia.iohttps://www.futurepedia.io/tool/ai-diary,Personal Assistant
Boba,"AI-driven strategic insights, scenario planning, and trend analysis.",Free,https://www.futurepedia.iohttps://www.futurepedia.io/tool/boba,Personal Assistant
Bottell,Your AI assistant for all things parenting.,Freemium,https://www.futurepedia.iohttps://www.futurepedia.io/tool/bottell,Personal Assistant
Clonemyvoice.io,Clone your voice instantly and surprise your loved ones with the most realistic voice imitation ever.,Paid,https://www.futurepedia.iohttps://www.futurepedia.io/tool/clonemyvoiceio,Personal Assistant
Stellar,Simplify and enhance the process of goal setting and tracking.,Contact for Pricing,https://www.futurepedia.iohttps://www.futurepedia.io/tool/stellar,Personal Assistant
Loti,AI-driven tool protecting public figures' digital content and likeness.,Paid,https://www.futurepedia.iohttps://www.futurepedia.io/tool/loti,Personal Assistant
WiseTalk,"WiseTalk app makes all human wisdom, remembered and processed by AI, accessible for anyone.",Free Trial,https://www.futurepedia.iohttps://www.futurepedia.io/tool/wisetalk,Personal Assistant
Cronbot AI,Transforming Data into Conversations,Free Trial,https://www.futurepedia.iohttps://www.futurepedia.io/tool/cronbot-ai,Personal Assistant
Empy.ai,Improve empathy in Slack with message analytics.,Contact for Pricing,https://www.futurepedia.iohttps://www.futurepedia.io/tool/empyai,Personal Assistant
MobileGPT,Docs and on-the-go comms personalization assistant.,Paid,https://www.futurepedia.iohttps://www.futurepedia.io/tool/mobilegpt,Personal Assistant
Nightcap,Nightcap Guru is an AI-based dream interpretation tool that helps users gain insight into the potential meanings of their dreams.,Paid,https://www.futurepedia.iohttps://www.futurepedia.io/tool/nightcap,Personal Assistant
Magicmate,"Transform tasks via AI on WhatsApp: chat, edit, translate, restore.",Free Trial,https://www.futurepedia.iohttps://www.futurepedia.io/tool/magicmate,Personal Assistant
Beeyond AI,Your All-In-One AI Digital Assistant,Paid,https://www.futurepedia.iohttps://www.futurepedia.io/tool/beeyond-ai,Personal Assistant
Littlecook.io,"LittlecookAI is an AI-powered tool that allows users to create unique recipes based on selected ingredients, providing a fun and creative platform for culinary exploration.",Free Trial,https://www.futurepedia.iohttps://www.futurepedia.io/tool/littlecookio,Personal Assistant
Screenapp,AI-powered transcription for converting video recordings into written documents.,Freemium,https://www.futurepedia.iohttps://www.futurepedia.io/tool/screenapp,Personal Assistant
MoodFood,AI-driven mood-based personalized food suggestions.,Freemium,https://www.futurepedia.iohttps://www.futurepedia.io/tool/moodfood,Personal Assistant
Gnothiai,"Journal and toolkit designed to support personal growth and well-being through self-reflection, meditation, and healthy living practices.",Freemium,https://www.futurepedia.iohttps://www.futurepedia.io/tool/gnothiai,Personal Assistant
Waitroom,"Maximize productivity with AI-driven analytics, automation, and customizable solutions.",Contact for Pricing,https://www.futurepedia.iohttps://www.futurepedia.io/tool/waitroom,Personal Assistant
Spellar AI,"Revolutionize meetings with AI-driven agendas, notes, and task tracking.",Contact for Pricing,https://www.futurepedia.iohttps://www.futurepedia.io/tool/spellar-ai,Personal Assistant
Clockk,"Automate time tracking, enhance productivity, bill accurately.",Paid,https://www.futurepedia.iohttps://www.futurepedia.io/tool/clockk,Personal Assistant
Beam,Enhance macOS productivity with seamless ChatGPT integration.,Paid,https://www.futurepedia.iohttps://www.futurepedia.io/tool/beam,Personal Assistant
Dreamt,Dreamt is an AI-enabled journal app that facilitates dream recording and reflection.,Paid,https://www.futurepedia.iohttps://www.futurepedia.io/tool/dreamt,Personal Assistant
ReadyMadeSpeech,Effortlessly craft personalized speeches for any occasion.,Paid,https://www.futurepedia.iohttps://www.futurepedia.io/tool/readymadespeech,Personal Assistant
FocusBuddy,AI-driven focus sessions enhance productivity and combat procrastination.,Free,https://www.futurepedia.iohttps://www.futurepedia.io/tool/focusbuddy,Personal Assistant
iMean AI Builder,Create a personalized AI assistant with advanced task automation.,Contact for Pricing,https://www.futurepedia.iohttps://www.futurepedia.io/tool/imean-ai-builder,Personal Assistant
Bottr,"Revolutionize task management and engagement with an adaptable, AI-powered assistant.",Free Trial,https://www.futurepedia.iohttps://www.futurepedia.io/tool/bottr,Personal Assistant
Antispace,"AI-driven tool automates emails, calendars, notes, Slack, GitHub.",Contact for Pricing,https://www.futurepedia.iohttps://www.futurepedia.io/tool/antispace,Personal Assistant
Sixty,Streamline your inbox and schedule with AI-driven email and relationship management.,Free,https://www.futurepedia.iohttps://www.futurepedia.io/tool/sixty,Personal Assistant
Clara,"An intelligent scheduling assistant that automates meeting coordination, streamlining your calendar management with advanced AI capabilities.",Free Trial,https://www.futurepedia.iohttps://www.futurepedia.io/tool/clara,Personal Assistant
Nex,Revolutionize document analysis with AI-driven speed and precision.,Contact for Pricing,https://www.futurepedia.iohttps://www.futurepedia.io/tool/nex,Personal Assistant
Supermemory,Transform data chaos into organized digital brilliance.,Contact for Pricing,https://www.futurepedia.iohttps://www.futurepedia.io/tool/supermemory,Personal Assistant
MemoryPlugin,"Enhances AI tools with seamless, cross-platform memory retention.",Paid,https://www.futurepedia.iohttps://www.futurepedia.io/tool/memoryplugin,Personal Assistant
Braudit,"Revolutionizes career management with personalized insights, documentation, and progress tracking.",Free Trial,https://www.futurepedia.iohttps://www.futurepedia.io/tool/braudit,Personal Assistant
Timetics,"AI-driven scheduling tool optimizing appointments, events, and payments.",Freemium,https://www.futurepedia.iohttps://www.futurepedia.io/tool/timetics,Personal Assistant
Kippy,Master languages with real-life conversations and instant feedback.,Contact for Pricing,https://www.futurepedia.iohttps://www.futurepedia.io/tool/kippy,Personal Assistant
Spatial Touch,Revolutionize device control with touchless gestures and seamless integration with popular apps.,Freemium,https://www.futurepedia.iohttps://www.futurepedia.io/tool/spatial-touch,Personal Assistant
Finding Words,"Navigate loss with AI-driven emotional, logistical support.",Free,https://www.futurepedia.iohttps://www.futurepedia.io/tool/finding-words,Personal Assistant
Ohai.ai,AI assistant simplifies household management through text-based coordination.,Contact for Pricing,https://www.futurepedia.iohttps://www.futurepedia.io/tool/ohai-ai,Personal Assistant
Me.bot,"AI assistant organizes, retrieves, and connects personal information effortlessly.",Freemium,https://www.futurepedia.iohttps://www.futurepedia.io/tool/me-bot,Personal Assistant
Friend,Revolutionize interactions with AI-driven task automation and emotional support.,Paid,https://www.futurepedia.iohttps://www.futurepedia.io/tool/friend,Personal Assistant
r1 by rabbit,"Experience pocket-sized AI brilliance with intuitive translations, smart connectivity, and tailored assistance.",Paid,https://www.futurepedia.iohttps://www.futurepedia.io/tool/r1,Personal Assistant
Zivy,AI-driven tool streamlines communication for engineering and product teams.,Contact for Pricing,https://www.futurepedia.iohttps://www.futurepedia.io/tool/zivy,Personal Assistant
Poised,Enhance your speaking with real-time feedback and personalized coaching.,Paid,https://www.futurepedia.iohttps://www.futurepedia.io/tool/poised-,Personal Assistant
Screentime,"Optimize screen time, boost productivity with AI insights.",Free Trial,https://www.futurepedia.iohttps://www.futurepedia.io/tool/screentime,Personal Assistant
Alice,"Boost productivity with AI-powered privacy, customization, and app integration.",Paid,https://www.futurepedia.iohttps://www.futurepedia.io/tool/alice,Personal Assistant
Deep Nostalgia,"Animate historical photos with AI, bringing family memories alive.",Freemium,https://www.futurepedia.iohttps://www.futurepedia.io/tool/deep-nostalgia,Portrait Generators
Gnomi App,"Unlock global perspectives, customize content, and engage with a diverse community in real-time.",Free,https://www.futurepedia.iohttps://www.futurepedia.io/tool/gnomi-app,Productivity
Consensus,"Unlock expert knowledge: AI-powered, ad-free research from 200M+ scientific papers.",Freemium,https://www.futurepedia.iohttps://www.futurepedia.io/tool/consensus,Productivity
Scite,Transform research with AI-driven Smart Citations and deep insights.,Free Trial,https://www.futurepedia.iohttps://www.futurepedia.io/tool/scite,Productivity
Rows AI,"Transform spreadsheets into AI-powered data analysis tools, simplifying complex insights.",Freemium,https://www.futurepedia.iohttps://www.futurepedia.io/tool/rows-ai,Productivity
Zoho Sheet,"Create, analyze, and collaborate on spreadsheets seamlessly online.",Contact for Pricing,https://www.futurepedia.iohttps://www.futurepedia.io/tool/zoho-sheet,Productivity
SheetAI.app,"Unleash AI in Google Sheets: automate, analyze, and create effortlessly.",Active deal,https://www.futurepedia.iohttps://www.futurepedia.io/tool/sheetai-app,Productivity
DeepL Translator,Transform text across 32 languages with unmatched accuracy.,Free Trial,https://www.futurepedia.iohttps://www.futurepedia.io/tool/deepl-translator,Productivity
Google Translate,"Instant translations across 100+ languages, voice, text, and image.",Free,https://www.futurepedia.iohttps://www.futurepedia.io/tool/google-translate,Productivity
Microsoft Translator,"Break language barriers: translate text, speech, real-time conversations.",Free,https://www.futurepedia.iohttps://www.futurepedia.io/tool/microsoft-translator,Productivity
Superhuman,"Revolutionize email with AI, speed, and intuitive productivity enhancements.",Paid,https://www.futurepedia.iohttps://www.futurepedia.io/tool/superhuman,Productivity
Shortwave,AI-powered email tool enhances productivity and organization.,Freemium,https://www.futurepedia.iohttps://www.futurepedia.io/tool/shortwave,Productivity
Merlin,"Enhance web productivity with AI: write, summarize, code, translate effortlessly.",Free,https://www.futurepedia.iohttps://www.futurepedia.io/tool/merlin,Productivity
Komo Search,"Revolutionize search with AI: intuitive, efficient, customizable, secure.",Freemium,https://www.futurepedia.iohttps://www.futurepedia.io/tool/komo-search,Productivity
GPTGO,"Unleash AI's power: intuitive, customizable, content-to-code generation.",Free,https://www.futurepedia.iohttps://www.futurepedia.io/tool/gptgo,Productivity
Roamaround,Unleash insights with AI-driven data mapping and collaborative visualization.,Free,https://www.futurepedia.iohttps://www.futurepedia.io/tool/roamaround,Project Management
Taskade,Unify team productivity with AI-driven task management and collaboration.,Freemium,https://www.futurepedia.iohttps://www.futurepedia.io/tool/taskade,Project Management
Ideabuddy,Turn ideas into business realities with structured planning and financial tools.,Active deal,https://www.futurepedia.iohttps://www.futurepedia.io/tool/ideabuddy,Project Management
PromptHero,"Streamline AI prompt management, enhance productivity, and creativity.",Free,https://www.futurepedia.iohttps://www.futurepedia.io/tool/prompthero,Project Management
PromptDrive.ai,Your All-in-one Prompt Management Tool,Free,https://www.futurepedia.iohttps://www.futurepedia.io/tool/promptdriveai,Project Management
Dataspot,AI-driven tool for comprehensive metadata management and governance.,Freemium,https://www.futurepedia.iohttps://www.futurepedia.io/tool/dataspot,Project Management
Tekmatix,"All-in-One CRM, Online Business, and Course Creation Platform",Free Trial,https://www.futurepedia.iohttps://www.futurepedia.io/tool/tekmatix,Project Management
PromptFolder,Centralize and streamline AI prompt management with organizational tools and a Chrome extension.,Free,https://www.futurepedia.iohttps://www.futurepedia.io/tool/promptfolder,Project Management
EducatorLab,"Revolutionize lesson planning with AI, enriching education through customization and collaboration.",Freemium,https://www.futurepedia.iohttps://www.futurepedia.io/tool/educatorlab,Project Management
Orygo AI,"Harness AI to centralize, search, and manage knowledge effortlessly across platforms.",Free Trial,https://www.futurepedia.iohttps://www.futurepedia.io/tool/orygo-ai,Project Management
Roboflow,"Empower AI with intuitive computer vision tools, training, and deployment.",Free Trial,https://www.futurepedia.iohttps://www.futurepedia.io/tool/roboflow,Project Management
NoteGenie,"Revolutionize note-taking with AI-powered transcription, organization, and seamless collaboration.",Freemium,https://www.futurepedia.iohttps://www.futurepedia.io/tool/notegenie,Project Management
Paxton AI,"Paxton AI is a cutting-edge legal assistant powered by Generative AI, designed to keep businesses ahead of regulatory changes",Free Trial,https://www.futurepedia.iohttps://www.futurepedia.io/tool/paxton-ai,Project Management
Supernormal,"Automate meeting notes with AI, integrating seamlessly into professional workflows.",Freemium,https://www.futurepedia.iohttps://www.futurepedia.io/tool/supernormal,Project Management
AI Storyboard Generator,"Eliminates the need for drawing skills, enabling quick and easy storyboard creation.",Paid,https://www.futurepedia.iohttps://www.futurepedia.io/tool/ai-storyboard-generator,Project Management
MyReport,"Revolutionize report generation with AI, ensuring quality and efficiency.",Free Trial,https://www.futurepedia.iohttps://www.futurepedia.io/tool/myreport,Project Management
Linksquares,"Revolutionize legal management: AI-powered contract analysis, negotiation, and project tracking.",Contact for Pricing,https://www.futurepedia.iohttps://www.futurepedia.io/tool/linksquares,Project Management
Coginiti,"Instant query assistance, on-demand learning, and collaborative workspaces for efficient data and analytic product development",Free Trial,https://www.futurepedia.iohttps://www.futurepedia.io/tool/coginiti,Project Management
Fibery Ai,"Streamline work, automate tasks, enhance team collaboration.",Freemium,https://www.futurepedia.iohttps://www.futurepedia.io/tool/fibery-ai,Project Management
Bidlytics,Streamlines government contract bids with AI-driven insights.,Contact for Pricing,https://www.futurepedia.iohttps://www.futurepedia.io/tool/bidlytics,Project Management
Hex Magic,"Streamline data workflows with collaborative, multi-language support.",Freemium,https://www.futurepedia.iohttps://www.futurepedia.io/tool/hex-magic,Project Management
Huddles,"Enhance team collaboration with integrated audio, video, and screen sharing.",Freemium,https://www.futurepedia.iohttps://www.futurepedia.io/tool/huddles,Project Management
Vendorful,"Streamline RFPs with AI: faster responses, optimized answers, secure data management.",Free Trial,https://www.futurepedia.iohttps://www.futurepedia.io/tool/vendorful,Project Management
Microsoft Knowledge Exploration,Unleash AI-powered data search and interactive exploration with customizable insights.,Contact for Pricing,https://www.futurepedia.iohttps://www.futurepedia.io/tool/microsoft-knowledge-exploration,Project Management
Folderr,"Streamline tasks, manage files, optimize workflow with AI.",Freemium,https://www.futurepedia.iohttps://www.futurepedia.io/tool/folderr,Project Management
Huntr,"Streamline job applications, optimize resumes, track progress efficiently.",Freemium,https://www.futurepedia.iohttps://www.futurepedia.io/tool/huntr,Project Management
Civils.ai,"Automates construction data extraction, compliance checks, and reporting.",Paid,https://www.futurepedia.iohttps://www.futurepedia.io/tool/civils-ai,Project Management
Liaise,Revolutionizes communication with AI-driven clarity and integration.,Contact for Pricing,https://www.futurepedia.iohttps://www.futurepedia.io/tool/liaise,Project Management
Pelles,AI-driven platform revolutionizing MEP preconstruction through automation and efficiency.,Contact for Pricing,https://www.futurepedia.iohttps://www.futurepedia.io/tool/pelles,Project Management
Parspec,Revolutionize product selection and quoting with AI-driven efficiency.,Paid,https://www.futurepedia.iohttps://www.futurepedia.io/tool/parspec,Project Management
Postman,Streamline API development with robust testing and automation tools.,Free Trial,https://www.futurepedia.iohttps://www.futurepedia.io/tool/postman,Project Management
E2open,Streamline supply chains with real-time visibility and AI-driven analytics.,Contact for Pricing,https://www.futurepedia.iohttps://www.futurepedia.io/tool/e2open,Project Management
Metaplane,"Monitor, manage, and enhance data integrity efficiently.",Freemium,https://www.futurepedia.iohttps://www.futurepedia.io/tool/metaplane,Project Management
AirOps,"Task-specific AI Apps that go beyond ChatGPT—run NLP, generate-data-informed content, draft/fix/optimize SQL queries, and more",Freemium,https://www.futurepedia.iohttps://www.futurepedia.io/tool/ai-data-sidekick,Project Management
Infield,"Automate upgrades, manage dependencies, minimize risks.",Contact for Pricing,https://www.futurepedia.iohttps://www.futurepedia.io/tool/infield,Project Management
Gridly,Streamline content management and localization across digital platforms.,Free Trial,https://www.futurepedia.iohttps://www.futurepedia.io/tool/gridly,Project Management
SYNQ,"Streamline communications, enrich data, and enhance productivity with SYNQ.",Contact for Pricing,https://www.futurepedia.iohttps://www.futurepedia.io/tool/synq,Project Management
Airtable AI,Transform operations with AI-driven workflow automation and data management.,Free Trial,https://www.futurepedia.iohttps://www.futurepedia.io/tool/airtable-ai,Project Management
Syncly,"Transform customer experiences with AI-driven feedback analysis, dynamic sentiment monitoring, and seamless integration.",Contact for Pricing,https://www.futurepedia.iohttps://www.futurepedia.io/tool/syncly,Project Management
Asseti,AI-driven platform for optimizing and managing business assets.,Contact for Pricing,https://www.futurepedia.iohttps://www.futurepedia.io/tool/asseti,Project Management
Impact AI,"Streamline AI management: strategy, oversight, user alignment.",Contact for Pricing,https://www.futurepedia.iohttps://www.futurepedia.io/tool/impact-ai,Project Management
Ideamap,"Unleash AI-driven brainstorming, collaboration, and dynamic idea organization.",Freemium,https://www.futurepedia.iohttps://www.futurepedia.io/tool/ideamap,Project Management
GovDash,"Streamline GovCon lifecycle: capture, proposal, contract management, automated compliance.",Contact for Pricing,https://www.futurepedia.iohttps://www.futurepedia.io/tool/govdash,Project Management
DevRev,Unifies customer support and software development with AI insights.,Free Trial,https://www.futurepedia.iohttps://www.futurepedia.io/tool/devrev,Project Management
MyNinja,Streamline tasks efficiently with MyNinja's Multi-Agent Autonomy.,Contact for Pricing,https://www.futurepedia.iohttps://www.futurepedia.io/tool/myninja,Project Management
Winn,"Streamline workflows, automate tasks, enhance collaboration.",Contact for Pricing,https://www.futurepedia.iohttps://www.futurepedia.io/tool/winn,Project Management
Quip,"Seamlessly integrate, collaborate, and manage workflows within Salesforce.",Paid,https://www.futurepedia.iohttps://www.futurepedia.io/tool/quip,Project Management
Document Crunch,AI-driven contract review tool for construction professionals.,Contact for Pricing,https://www.futurepedia.iohttps://www.futurepedia.io/tool/document-crunch,Project Management
Zylon,AI-driven tool that autonomously enhances business productivity and collaboration.,Contact for Pricing,https://www.futurepedia.iohttps://www.futurepedia.io/tool/zylon,Project Management
OpenCall.ai,"Automate call handling, appointments, and workflows effortlessly with AI-driven precision and HIPAA compliance.",Contact for Pricing,https://www.futurepedia.iohttps://www.futurepedia.io/tool/opencallai,Project Management
Version Lens,AI-driven product management and feedback integration via Slack.,Contact for Pricing,https://www.futurepedia.iohttps://www.futurepedia.io/tool/version-lens,Project Management
OpenSpace,AI-driven reality capture and analytics for construction sites.,Contact for Pricing,https://www.futurepedia.iohttps://www.futurepedia.io/tool/openspace,Project Management
4mAnalytics,Revolutionizes subsurface utility mapping with advanced AI and real-time data.,Contact for Pricing,https://www.futurepedia.iohttps://www.futurepedia.io/tool/4manalytics,Project Management
