Tool Name,Summary,Pricing,Link,Category
Avath,"Transform journal entries into visually captivating representations, creating an engaging and creative journaling experience.",Free Trial,https://www.futurepedia.iohttps://www.futurepedia.io/tool/avath,Image Generators
AI Photo,Generate stunning images from text prompts with offline AI.,Paid,https://www.futurepedia.iohttps://www.futurepedia.io/tool/ai-photo,Image Generators
BestBanner,Create unique and captivating banner images that complement article text.,Free Trial,https://www.futurepedia.iohttps://www.futurepedia.io/tool/bestbanner,Image Generators
Usp.ai,Generate high-quality images from text with advanced AI.,Freemium,https://www.futurepedia.iohttps://www.futurepedia.io/tool/uspai,Image Generators
B^ DISCOVER,"AI-driven platform creating unique, high-quality images effortlessly.",Paid,https://www.futurepedia.iohttps://www.futurepedia.io/tool/b-discover,Image Generators
Lionvaplus,AI-Powered Photorealistic Product Image Generation,Paid,https://www.futurepedia.iohttps://www.futurepedia.io/tool/lionvaplus,Image Generators
AI Baby Generator,AI Baby Generator is an AI-powered tool that predicts what a baby will look like based on parent photos or physical descriptions.,Paid,https://www.futurepedia.iohttps://www.futurepedia.io/tool/ai-baby-generator,Image Generators
Qriginals,Empowers users to create and share visually stunning QR code art.,Paid,https://www.futurepedia.iohttps://www.futurepedia.io/tool/qriginals,Image Generators
Artiphoria,"Generate unlimited unique images, it's the perfect solution for unleashing your creativity and producing original art.",Free Trial,https://www.futurepedia.iohttps://www.futurepedia.io/tool/artiphoria,Image Generators
Stablecog,Stablecog is an open-source AI image generator that leverages the power of Stable Diffusion to produce high-quality visuals,Paid,https://www.futurepedia.iohttps://www.futurepedia.io/tool/stablecog,Image Generators
Micropay,"Generate unique, high-quality images with intuitive AI integration.",Freemium,https://www.futurepedia.iohttps://www.futurepedia.io/tool/micropay,Image Generators
Imaginator,"Transform text into stunning, high-quality images effortlessly.",Paid,https://www.futurepedia.iohttps://www.futurepedia.io/tool/imaginator,Image Generators
ZMO,"Seamlessly turn text and images into diverse, AI-driven visual masterpieces.",Freemium,https://www.futurepedia.iohttps://www.futurepedia.io/tool/zmo,Image Generators
No More Copyright,"Generate instant, copyright-free images with AI-driven precision.",Free,https://www.futurepedia.iohttps://www.futurepedia.io/tool/no-more-copyright,Image Generators
AI Image Generator,AI Image Generator by Brain Pod AI is an advanced tool that uses artificial intelligence to quickly and easily generate various types of digital images based on text prompts.,Paid,https://www.futurepedia.iohttps://www.futurepedia.io/tool/ai-image-generator,Image Generators
camp,Revolutionize screenshot organization and information extraction with AI-powered precision.,Freemium,https://www.futurepedia.iohttps://www.futurepedia.io/tool/camp,Image Generators
Fal,"Revolutionizes generative media with lightning-fast, cost-effective text-to-image inference.",Paid,https://www.futurepedia.iohttps://www.futurepedia.io/tool/fal,Image Generators
Racr,"Unlock AI-powered vehicle diagnostics, customizations, and maintenance solutions with innovative image generation.",Paid,https://www.futurepedia.iohttps://www.futurepedia.io/tool/racr,Image Generators
Visual Electric,AI-driven image generator for creative professionals.,Freemium,https://www.futurepedia.iohttps://www.futurepedia.io/tool/visual-electric,Image Generators
Lummi,"Revolutionize projects with diverse, AI-searchable, free high-quality stock photos.",Free,https://www.futurepedia.iohttps://www.futurepedia.io/tool/lummi,Image Generators
Snapcraft,"AI-driven virtual photo studio, revolutionizes product photography",Free Trial,https://www.futurepedia.iohttps://www.futurepedia.io/tool/snapcraft,Image Generators
Snowpixel,"AI-powered tool for transforming text into images, videos, music, and 3D objects.",Paid,https://www.futurepedia.iohttps://www.futurepedia.io/tool/snowpixel,Image Generators
FluxAI Pro,"AI-powered tool for stunning, high-resolution image generation.",Free Trial,https://www.futurepedia.iohttps://www.futurepedia.io/tool/fluxai-pro,Image Generators
Namecheap Logo Maker,"AI-powered logo creation, high-res downloads, intuitive customization.",Free,https://www.futurepedia.iohttps://www.futurepedia.io/tool/namecheap-logo-maker,Logo Generator
Namy.ai,AI-powered domain brainstorming with instant availability checks.,Free,https://www.futurepedia.iohttps://www.futurepedia.io/tool/namy-ai,Logo Generator
DomainsGPT,"Revolutionize domain naming with AI: vast options, user-friendly, free tier.",Freemium,https://www.futurepedia.iohttps://www.futurepedia.io/tool/domainsgpt,Logo Generator
LogoAI,"Revolutionize branding with AI: logos, identities, and content made simple.",Paid,https://www.futurepedia.iohttps://www.futurepedia.io/tool/logoai,Logo Generator
Zarla AI,Create a Beautiful Website in Seconds,Free Trial,https://www.futurepedia.iohttps://www.futurepedia.io/tool/zarla-ai,Logo Generator
Tailor Brands,"Streamline business setup, branding, and management with AI-powered tools.",Free Trial,https://www.futurepedia.iohttps://www.futurepedia.io/tool/tailor-brands,Logo Generator
Brandmark,Revolutionize logo design with AI-powered creativity and simplicity.,Freemium,https://www.futurepedia.iohttps://www.futurepedia.io/tool/brandmark,Logo Generator
Diffusion Logo Studio,Revolutionize your logo design with Diffusion Logo Studio,Paid,https://www.futurepedia.iohttps://www.futurepedia.io/tool/diffusion-logo-studio,Logo Generator
LogoCreatorAI,"AI-powered tool for instant, high-quality, custom logo creation.",Paid,https://www.futurepedia.iohttps://www.futurepedia.io/tool/logocreatorai,Logo Generator
Ameela,Ameela is a free logo design maker for startups that claims to be inspired by AI.,Free,https://www.futurepedia.iohttps://www.futurepedia.io/tool/ameela,Logo Generator
AppLogoCreater,Your personal logo designer powered by AI,Paid,https://www.futurepedia.iohttps://www.futurepedia.io/tool/applogocreater,Logo Generator
Logodiffusion,"AI-powered platform that enables users to design high-quality logos and graphic designs in seconds, eliminating the need for templates and offering advanced editing features.",Freemium,https://www.futurepedia.iohttps://www.futurepedia.io/tool/logodiffusion,Logo Generator
IconWizardAI,"AI-driven tool for effortless, unique icon creation.",Paid,https://www.futurepedia.iohttps://www.futurepedia.io/tool/iconwizardai,Logo Generator
Zoviz,"AI-driven platform for instant, professional branding and logo creation.",Paid,https://www.futurepedia.iohttps://www.futurepedia.io/tool/zoviz,Logo Generator
DesignEvo,"AI-powered online logo maker that simplifies the logo design process, turning your branding ideas into reality with ease and creativity.",Freemium,https://www.futurepedia.iohttps://www.futurepedia.io/tool/designevo,Logo Generator
Tome,AI-driven tool streamlines sales targeting and personalized outreach.,Free,https://www.futurepedia.iohttps://www.futurepedia.io/tool/tome,Marketing
Piggy,"Transforming mobile content creation with AI-driven customization, real-time editing, and seamless sharing for creators on the go.",Free,https://www.futurepedia.iohttps://www.futurepedia.io/tool/piggy,Marketing
Writesonic,"Boost productivity with AI: content, visuals, insights, and real-time data.",Freemium,https://www.futurepedia.iohttps://www.futurepedia.io/tool/writesonic,Marketing
MarketingBlocks,"Unleash AI-powered content, design, and marketing efficiency in one platform.",Freemium,https://www.futurepedia.iohttps://www.futurepedia.io/tool/marketingblock-ai,Marketing
PowerMode AI,Optimize business operations with AI-driven insights and automation.,Free,https://www.futurepedia.iohttps://www.futurepedia.io/tool/powermode-ai,Marketing
Munch,"Maximize video impact with AI-driven, trend-optimized social media clips.",Active deal,https://www.futurepedia.iohttps://www.futurepedia.io/tool/munch,Marketing
SEO GPT,AI-driven SEO enhancer utilizing live data for unique content creation.,Free,https://www.futurepedia.iohttps://www.futurepedia.io/tool/seo-gpt,Marketing
Neurons AI,Enhance marketing with neuroscience-driven insights for optimized campaigns.,Paid,https://www.futurepedia.iohttps://www.futurepedia.io/tool/neurons-ai,Marketing
Shuffll,AI-powered tool simplifies branded video creation and scaling.,Paid,https://www.futurepedia.iohttps://www.futurepedia.io/tool/shuffll,Marketing
Moonbeam,Revolutionize long-form writing with AI-driven coherence and style versatility.,Free Trial,https://www.futurepedia.iohttps://www.futurepedia.io/tool/moonbeam,Marketing
Klap,AI transforms long videos into viral short clips effortlessly.,Free Trial,https://www.futurepedia.iohttps://www.futurepedia.io/tool/klap,Marketing
Video to Blog,"Convert videos into multilingual, SEO-optimized blog articles instantly.",Freemium,https://www.futurepedia.iohttps://www.futurepedia.io/tool/videotoblog,Marketing
Build AI,"Build AI helps you quickly create and publish AI apps, with the ability to update and refine.",Contact for Pricing,https://www.futurepedia.iohttps://www.futurepedia.io/tool/build-ai,Marketing
AI Transcription by Riverside,AI-powered multilingual transcription with speaker detection and integration.,Freemium,https://www.futurepedia.iohttps://www.futurepedia.io/tool/ai-transcription-by-riverside,Marketing
Zapt,Effortlessly create AI apps with no coding required.,Freemium,https://www.futurepedia.iohttps://www.futurepedia.io/tool/zapt,Marketing
Aidaptive,AI-driven tool for personalized recommendations and predictive analytics.,Free Trial,https://www.futurepedia.iohttps://www.futurepedia.io/tool/aidaptive,Marketing
Chatbase,Build an AI chatbot trained on your data.,Paid,https://www.futurepedia.iohttps://www.futurepedia.io/tool/chatbase,Marketing
Taplio,Grow your personal brand on LinkedIn,Free Trial,https://www.futurepedia.iohttps://www.futurepedia.io/tool/taplio,Marketing
Syllaby,AI tool automating educational content creation and collaboration.,Freemium,https://www.futurepedia.iohttps://www.futurepedia.io/tool/syllaby,Marketing
Lunaa,Create better LinkedIn content 10x Faster with AI.,Free Trial,https://www.futurepedia.iohttps://www.futurepedia.io/tool/lunaa,Marketing
Soofy,"Streamline tasks, analyze data, enhance decision-making with AI-powered efficiency.",Free Trial,https://www.futurepedia.iohttps://www.futurepedia.io/tool/soofy,Marketing
Pebblely,Unleash AI-driven insights and automation for enhanced productivity across sectors.,Free Trial,https://www.futurepedia.iohttps://www.futurepedia.io/tool/pebblely,Marketing
PromptBase,"Marketplace for buying, selling, and discovering AI prompts.",Freemium,https://www.futurepedia.iohttps://www.futurepedia.io/tool/promptbase,Marketing
Vondy AI,AI creativity assistant,Free Trial,https://www.futurepedia.iohttps://www.futurepedia.io/tool/vondy-ai,Marketing
KeywordSearch,Optimize ad targeting and keyword strategy with AI-driven insights for Google and YouTube campaigns.,Free Trial,https://www.futurepedia.iohttps://www.futurepedia.io/tool/keywordsearch,Marketing
vidIQ,Elevate YouTube success with AI-driven analytics and optimization tools.,Freemium,https://www.futurepedia.iohttps://www.futurepedia.io/tool/vidiq,Marketing
BrandScript Generator,AI-driven tool for crafting impactful brand narratives effortlessly.,Free,https://www.futurepedia.iohttps://www.futurepedia.io/tool/brandscript-generator,Marketing
Voxwave AI,Transform email campaigns with personalized AI voice cloning and analytics.,Contact for Pricing,https://www.futurepedia.iohttps://www.futurepedia.io/tool/voxwave-ai,Marketing
Murf,Elevate content with lifelike AI voiceovers in 20+ languages and voice cloning.,Free Trial,https://www.futurepedia.iohttps://www.futurepedia.io/tool/murf-ai,Marketing
Sellesta,AI-enhanced ad optimization for e-commerce sales growth.,Contact for Pricing,https://www.futurepedia.iohttps://www.futurepedia.io/tool/sellesta,Marketing
BrandBastion,AI-driven tool for 24/7 social media management and protection.,Contact for Pricing,https://www.futurepedia.iohttps://www.futurepedia.io/tool/brandbastion,Marketing
Opus,"Revolutionize content creation with AI-driven optimization, collaboration, and analytics.",Contact for Pricing,https://www.futurepedia.iohttps://www.futurepedia.io/tool/opus,Marketing
One AI,Boost website engagement and sales with adaptive AI-driven interactions.,Freemium,https://www.futurepedia.iohttps://www.futurepedia.io/tool/one-ai,Marketing
Contents,Contents is the Generative AI platform to create impactful content built for performance,Free Trial,https://www.futurepedia.iohttps://www.futurepedia.io/tool/contents,Marketing
Pictory,Transform text into polished videos effortlessly; edit with ease.,Free Trial,https://www.futurepedia.iohttps://www.futurepedia.io/tool/pictory,Marketing
Automata,"Transform videos and PDFs into fresh, engaging content effortlessly.",Free Trial,https://www.futurepedia.iohttps://www.futurepedia.io/tool/automata,Marketing
Luminal,"Unlock productivity with AI-driven automation, analytics, and scalable workflows.",Freemium,https://www.futurepedia.iohttps://www.futurepedia.io/tool/luminal,Marketing
AI Social Media Post Generator,Publish timely content that grabs attention and elevates your brand's visibility. Made by Semrush.,Free,https://www.futurepedia.iohttps://www.futurepedia.io/tool/ai-social-media-post-generator-or-semrush,Marketing
Flowjin,Transform long-form content into engaging clips with AI-driven repurposing.,Paid,https://www.futurepedia.iohttps://www.futurepedia.io/tool/flowjin,Marketing
Gizzmo,AI-driven plugin boosts Amazon affiliate earnings with SEO content.,Free Trial,https://www.futurepedia.iohttps://www.futurepedia.io/tool/gizzmo-ai,Marketing
ChatNBX,"Unleash AI-enhanced, seamless communication across devices; ideal for teams and customer support.",Active deal,https://www.futurepedia.iohttps://www.futurepedia.io/tool/chatnbx,Marketing
Journey.io,"Optimize customer lifecycle with unified engagement, sales, and onboarding platform.",Freemium,https://www.futurepedia.iohttps://www.futurepedia.io/tool/journey-io,Marketing
Kaiber,Streamlines media creation with AI-driven editing and collaboration.,Freemium,https://www.futurepedia.iohttps://www.futurepedia.io/tool/kaiberai,Marketing
Octane AI,"Elevate e-commerce with personalized quizzes, data insights, and robust integrations.",Free Trial,https://www.futurepedia.iohttps://www.futurepedia.io/tool/octane-ai,Marketing
Flickify,Transform text and URLs into engaging videos effortlessly.,Free Trial,https://www.futurepedia.iohttps://www.futurepedia.io/tool/flickify,Marketing
Vidiofy,Transform text into captivating reel-style videos effortlessly with AI.,Free Trial,https://www.futurepedia.iohttps://www.futurepedia.io/tool/vidiofy,Marketing
Neural Newsletters,AI-driven tool automating newsletter creation and distribution.,Free Trial,https://www.futurepedia.iohttps://www.futurepedia.io/tool/neural-newsletters,Marketing
Tweet Hunter,"Elevate Twitter strategy with AI content, analytics, and CRM tools.",Free Trial,https://www.futurepedia.iohttps://www.futurepedia.io/tool/tweet-hunter,Marketing
Glimpse,AI-powered browser extension enhancing browsing with tailored insights.,Free,https://www.futurepedia.iohttps://www.futurepedia.io/tool/glimpse,Marketing
Keywords Everwhere,Unlock SEO insights across platforms with real-time keyword data.,Paid,https://www.futurepedia.iohttps://www.futurepedia.io/tool/keywords-everwhere,Marketing
Fliz,Transform text to engaging videos swiftly with AI-driven simplicity and creativity.,Freemium,https://www.futurepedia.iohttps://www.futurepedia.io/tool/fliz,Marketing
Helper,"Helper is an AI-powered tool that provides direct access to ChatGPT within your favorite apps, eliminating the need for context switching.",Free,https://www.futurepedia.iohttps://www.futurepedia.io/tool/helper,Marketing
QuantPlus,AI-driven tool optimizing ad campaigns with creative insights.,Contact for Pricing,https://www.futurepedia.iohttps://www.futurepedia.io/tool/quantplus,Marketing
Heylibby.ai,"Automate lead qualification and scheduling with intelligent, customizable AI.",Free,https://www.futurepedia.iohttps://www.futurepedia.io/tool/heylibbyai,Marketing
Feedeo,Create engaging interactive videos with AI avatars effortlessly.,Freemium,https://www.futurepedia.iohttps://www.futurepedia.io/tool/feedeo,Marketing
Spiritme,Create AI videos with avatars with realistic emotions from text in minutes.,Free Trial,https://www.futurepedia.iohttps://www.futurepedia.io/tool/spiritme,Marketing
RhetorAI,"Harness AI-driven insights with multilingual, 24/7 customer feedback analysis.",Freemium,https://www.futurepedia.iohttps://www.futurepedia.io/tool/rhetorai,Marketing
Claude 3,"Revolutionize workflows with AI-driven text, analytics, automation.",Freemium,https://www.futurepedia.iohttps://www.futurepedia.io/tool/claude,Marketing
Guidde,Transform documentation with AI-driven video creation and sharing.,Freemium,https://www.futurepedia.iohttps://www.futurepedia.io/tool/guidde,Marketing
Reply.io,"Automate sales outreach, analyze performance, integrate seamlessly.",Freemium,https://www.futurepedia.iohttps://www.futurepedia.io/tool/replyio,Marketing
Captain,"Automated content creation, engagement, and real-time lead identification.",Active deal,https://www.futurepedia.iohttps://www.futurepedia.io/tool/captain,Marketing
Video Candy,Every tool you need to edit videos online. Free and easy to use!,Freemium,https://www.futurepedia.iohttps://www.futurepedia.io/tool/video-candy,Marketing
CTRify,"AI-powered SEO tool for optimized websites, content, and backlinks.",Free Trial,https://www.futurepedia.iohttps://www.futurepedia.io/tool/ctrify,Marketing
Vizologi,"Unleash AI-driven business strategy, market analysis, and plan automation.",Active deal,https://www.futurepedia.iohttps://www.futurepedia.io/tool/vizologi,Marketing
Exoname,AI-driven domain name generator with manual customization options.,Free,https://www.futurepedia.iohttps://www.futurepedia.io/tool/exoname,Marketing
Captions,The all-in-one AI powered creator studio,Freemium,https://www.futurepedia.iohttps://www.futurepedia.io/tool/captions,Marketing
Muse.ai,"AI-driven video platform: manage, search, customize effortlessly.",Freemium,https://www.futurepedia.iohttps://www.futurepedia.io/tool/museai,Marketing
Insight7,Harness AI to distill customer feedback into actionable product and marketing insights.,Paid,https://www.futurepedia.iohttps://www.futurepedia.io/tool/insight7,Marketing
Quick Creator,"AI-driven platform for quick, SEO-optimized content creation.",Free Trial,https://www.futurepedia.iohttps://www.futurepedia.io/tool/quick-creator,Marketing
Simplified,"Streamline marketing, design, and social media with AI-powered tools.",Paid,https://www.futurepedia.iohttps://www.futurepedia.io/tool/simplified,Marketing
SynthMind AI,AI-powered tool for targeted social media growth automation.,Free Trial,https://www.futurepedia.iohttps://www.futurepedia.io/tool/synthmind-ai,Marketing
Veed.io,"Streamline video creation with AI-powered editing, automatic subtitles, and collaborative tools.",Freemium,https://www.futurepedia.iohttps://www.futurepedia.io/tool/veedio,Marketing
Autodraft,"AI tool transforming ideas into engaging, high-quality content.",Freemium,https://www.futurepedia.iohttps://www.futurepedia.io/tool/autodraft,Marketing
Botly,AI chatbot enhances OnlyFans creator-fan interactions and revenue.,Free Trial,https://www.futurepedia.iohttps://www.futurepedia.io/tool/botly,Marketing
YT Copycat,"AI boosts YouTube content creation with scripts, SEO, insights.",Free Trial,https://www.futurepedia.iohttps://www.futurepedia.io/tool/yt-copycat,Marketing
Graphy,Revolutionizes data visualization with AI insights and seamless integrations.,Freemium,https://www.futurepedia.iohttps://www.futurepedia.io/tool/graphy,Marketing
Visla,"Harness AI for effortless video creation, editing, and collaboration.",Freemium,https://www.futurepedia.iohttps://www.futurepedia.io/tool/visla,Marketing
LOVO,"Harness AI to create lifelike, multilingual voiceovers with emotional depth.",Freemium,https://www.futurepedia.iohttps://www.futurepedia.io/tool/lovo,Marketing
Regie,Transform sales with AI-driven prospecting and content automation.,Contact for Pricing,https://www.futurepedia.iohttps://www.futurepedia.io/tool/regie,Marketing
Checklist.gg,Optimize workflows with AI-powered checklist creation and collaborative task management.,Active deal,https://www.futurepedia.iohttps://www.futurepedia.io/tool/checklistgg,Marketing
Pth.AI,"Empower your professional goals with AI-driven insights, tailored action plans, and intuitive domain navigation.",Free,https://www.futurepedia.iohttps://www.futurepedia.io/tool/pthai,Marketing
Yepp AI,Your Ultimate Solution for Transforming Data into Exceptional Content!,Free Trial,https://www.futurepedia.iohttps://www.futurepedia.io/tool/yepp-ai,Marketing
Hypergro,AI-driven video ad creation for targeted audience engagement and sales.,Contact for Pricing,https://www.futurepedia.iohttps://www.futurepedia.io/tool/hypergro,Marketing
Automateed,Create professional eBooks swiftly with AI-driven content and design.,Paid,https://www.futurepedia.iohttps://www.futurepedia.io/tool/automateed,Marketing
Block Survey,"Privacy-first, AI-powered surveys with end-to-end encryption.",Active deal,https://www.futurepedia.iohttps://www.futurepedia.io/tool/block-survey,Marketing
Peasy Sales,Revolutionize sales with AI-driven multi-channel engagement and insightful analytics.,Active deal,https://www.futurepedia.iohttps://www.futurepedia.io/tool/peasy-sales,Marketing
Vibeo,AI-enhanced platform for collecting and using video testimonials.,Freemium,https://www.futurepedia.iohttps://www.futurepedia.io/tool/vibeo,Marketing
Jazon - AI SDR,Your 1000x AI Sales Development Representative.,Free Trial,https://www.futurepedia.iohttps://www.futurepedia.io/tool/jazon,Marketing
SEOWriting AI,"Effortlessly create multilingual, SEO-optimized content with AI.",Free Trial,https://www.futurepedia.iohttps://www.futurepedia.io/tool/seowriting-ai,Marketing
Flowpoint,Revolutionize website performance with AI-driven user behavior insights and real-time analytics.,Free Trial,https://www.futurepedia.iohttps://www.futurepedia.io/tool/flowpoint,Marketing
Keyword Discovery,AI-driven tool simplifying keyword research and on-page SEO.,Active deal,https://www.futurepedia.iohttps://www.futurepedia.io/tool/keyword-discovery,Marketing
Kraftful,Transforms user feedback into actionable insights efficiently.,Freemium,https://www.futurepedia.iohttps://www.futurepedia.io/tool/kraftful,Marketing
Swell AI,"Maximize content reach: automate transcripts, clips, articles, social posts.",Freemium,https://www.futurepedia.iohttps://www.futurepedia.io/tool/swell-ai,Marketing
ReachOut.AI,"Transform prospect engagement with AI-powered personalized video messages at scale, integrating seamlessly with CRMs and email platforms.",Free Trial,https://www.futurepedia.iohttps://www.futurepedia.io/tool/reachoutai,Marketing
Squirrly SEO,"Elevate WordPress SEO: Automation, analytics, real-time guidance, multilingual keyword research.",Paid,https://www.futurepedia.iohttps://www.futurepedia.io/tool/squirrly-seo,Marketing
Steamship,Build and deploy AI agents seamlessly with serverless cloud hosting.,Contact for Pricing,https://www.futurepedia.iohttps://www.futurepedia.io/tool/steamship,Marketing
Blaze,AI-driven platform streamlining brand-aligned content creation effortlessly.,Free Trial,https://www.futurepedia.iohttps://www.futurepedia.io/tool/blaze,Marketing
Comment Generator,"Boost social media engagement with AI-crafted, personalized comments in any language.",Free Trial,https://www.futurepedia.iohttps://www.futurepedia.io/tool/comment-generator,Marketing
WebWave,AI-powered website builder with drag-and-drop design freedom.,Free Trial,https://www.futurepedia.iohttps://www.futurepedia.io/tool/webwave,Marketing
Freepik AI Voice Generator,Transform text into lifelike speech with customizable options.,Free Trial,https://www.futurepedia.iohttps://www.futurepedia.io/tool/freepik-ai-voice-generator,Marketing
Lavender,"Transform email crafting with AI-driven feedback, personalization, and real-time coaching.",Free Trial,https://www.futurepedia.iohttps://www.futurepedia.io/tool/lavender,Marketing
AI Image to Caption Generator,Transform photos into engaging captions using AI technology.,Freemium,https://www.futurepedia.iohttps://www.futurepedia.io/tool/ai-image-to-caption-generator,Marketing
Google Earth Studio,Animate Earth's imagery for cinematic storytelling with Google Earth Studio.,Free,https://www.futurepedia.iohttps://www.futurepedia.io/tool/google-earth-studio,Marketing
Klenty,"Boost sales productivity with automated outreach, multi-channel engagement, and insightful analytics.",Paid,https://www.futurepedia.iohttps://www.futurepedia.io/tool/klenty,Marketing
RoboReply,AI-driven Google review management for enhanced local SEO.,Paid,https://www.futurepedia.iohttps://www.futurepedia.io/tool/roboreply,Marketing
MagicPost,Craft engaging LinkedIn posts effortlessly.,Free Trial,https://www.futurepedia.iohttps://www.futurepedia.io/tool/magicpost,Marketing
Threado AI,Enables users to create custom trained AI applications for instant support and query answering.,Free Trial,https://www.futurepedia.iohttps://www.futurepedia.io/tool/threado-ai,Marketing
Vimeo AI,"Revolutionize video creation with AI scripting, editing, and teleprompting.",Paid,https://www.futurepedia.iohttps://www.futurepedia.io/tool/vimeo-ai,Marketing
